Name,Artist,Album Artist,Composer,Album,Genre,Size (MB),Total Time (min),Track Number,Track Count,Year,Date Added,Play Count,Play Date,Skip Count,Skip Date,Release Date,Explicit,Favorited,Part Of Gapless Album,Normalized Genre
HUMBLE.,Kendrick Lamar,Kendrick Lamar,"Kendrick Lamar, A. Hogan, Michael L. Williams II & K. Duckworth",DAMN.,Hip-Hop/Rap,6.09,2:57,8,14,2017,2017-06-01 14:29:37,20,2025-04-18 10:20:16,6,2024-06-10 22:51:25,2017-03-31 07:00:00,True,False,False,Hip-Hop/Rap
DNA.,Kendrick Lamar,Kendrick Lamar,K. Duckworth & M. Williams II,DAMN.,Hip-Hop/Rap,6.42,3:05,2,14,2017,2017-06-01 14:30:21,19,2025-02-14 18:32:07,12,2024-03-03 16:15:35,2017-04-14 12:00:00,True,False,False,Hip-Hop/Rap
Mask Off,Future,Future,"Nayvadius Wilburn, Leland Wayne & Tommy Butler",FUTURE,Hip-Hop/Rap,6.97,3:24,7,20,2017,2017-06-01 14:30:24,15,2025-02-10 18:43:35,4,2023-05-26 07:06:50,2017-02-17 08:00:00,True,False,False,Hip-Hop/Rap
Congratulations (feat. Quavo),Post Malone,Post Malone,"Austin Post, Louis Bell, Adam Feeney, Quavious Marshall & Leland Wayne",Stoney (Deluxe),Hip-Hop/Rap,7.49,3:40,12,18,2016,2017-06-01 14:30:27,33,2025-05-20 22:40:30,9,2024-01-31 06:37:47,2016-11-04 07:00:00,True,True,False,Hip-Hop/Rap
Portland (feat. Quavo & Travis Scott),Drake,Drake,"Aubrey Drake Graham, Q. Marshall, J. Webster, S. Lindstorm, Tim Gomringer & Kevin Gomringer",More Life,Hip-Hop/Rap,7.97,3:56,11,22,2017,2017-06-01 14:31:42,26,2024-07-04 04:48:18,6,2024-02-09 19:03:43,2017-03-18 12:00:00,True,False,False,Hip-Hop/Rap
Passionfruit,Drake,Drake,Aubrey Drake Graham & Nana Bediako Rogues,More Life,Hip-Hop/Rap,9.98,4:58,3,22,2017,2017-06-01 14:32:21,15,2024-09-18 22:55:04,3,2023-08-27 00:19:49,2017-03-18 12:00:00,True,False,False,Hip-Hop/Rap
LOYALTY. (FEAT. RIHANNA.),Kendrick Lamar,Kendrick Lamar,"K. Duckworth, D. Natche, M. Spears, Anthony Tiffith & T. Martin",DAMN.,Hip-Hop/Rap,7.7,3:47,6,14,2017,2017-06-01 14:32:26,22,2025-03-24 02:32:06,8,2025-03-24 02:28:16,2017-04-14 12:00:00,True,False,False,Hip-Hop/Rap
Tunnel Vision,Kodak Black,Kodak Black,"Kevin Gomringer, Kodak Black, Metro Boomin, Southside & Tim Gomringer",Painting Pictures,Hip-Hop,9.09,4:28,10,18,2017,2017-06-01 14:33:36,23,2024-12-29 23:16:28,5,2021-12-19 15:35:13,2017-02-17 08:00:00,True,False,False,Hip-Hop/Rap
goosebumps,Travis Scott,Travis Scott,"Jacques Webster II, Kendrick Duckworth, Ronald LaTour, Daveon Jackson, Tim Gomringer, Kevin Gomringer & Brock Korsan",Birds In The Trap Sing McKnight,Hip-Hop/Rap,8.19,4:03,9,14,2016,2017-06-01 14:33:50,10,2025-02-11 20:02:42,4,2021-05-07 21:47:40,2016-09-02 07:00:00,True,False,False,Hip-Hop/Rap
Bad and Boujee (feat. Lil Uzi Vert),Migos,Migos,"Quavious Marshall, Kiari Cephus, Kirshnick Ball, Symere Woods, Leland Wayne & Robert Mandell",Culture,Hip-Hop/Rap,11.42,5:43,4,13,2016,2017-06-01 14:34:43,15,2025-04-12 02:02:54,5,2024-02-10 04:10:38,2016-10-28 12:00:00,True,False,False,Hip-Hop/Rap
T-Shirt,Migos,Migos,"Quavious Marshall, Kiari Cephus, Kirshnick Ball, James Bernard Rosser Jr., Brandon Rackley & Trevon Campbell",Culture,Hip-Hop/Rap,8.22,4:02,2,13,2017,2017-06-01 14:34:58,11,2025-03-28 20:48:26,2,2019-12-18 21:47:16,2017-01-27 12:00:00,True,False,False,Hip-Hop/Rap
Free Smoke,Drake,Drake,"Aubrey Drake Graham, Matthew Jehu Samuels, A. Ritter, M. Bernard, Bryan Antoine, D Sewell, Paul Bender, Simon Mavin, Perrin Moss & Naomi Saalfield",More Life,Hip-Hop/Rap,7.42,3:38,1,22,2017,2017-06-01 14:36:14,16,2025-06-29 06:01:47,5,2021-12-22 20:29:46,2017-03-18 12:00:00,True,False,False,Hip-Hop/Rap
Ice Melts (feat. Young Thug),Drake,Drake,"Aubrey Drake Graham, J.Williams, DeMario Priester, L. Griffin Jr & J. Priester",More Life,Hip-Hop/Rap,8.39,4:10,21,22,2017,2017-06-01 14:38:16,13,2025-06-22 05:09:59,3,2024-01-20 02:28:27,2017-03-18 12:00:00,True,False,False,Hip-Hop/Rap
No Problem (feat. Lil Wayne & 2 Chainz),Chance the Rapper,Chance the Rapper,"2 Chainz, Ashwin Torke, Brass Tracks, Cam O'bi, Chance the Rapper, HaHa Davis, James Francies, Jamie Woods, Jeff Lane, Jonathan Hoard, Lakeitsha Williams, Lil Wayne, Rachel Cato & Zarif Wilder",Coloring Book,Hip-Hop/Rap,10.14,5:04,2,14,2016,2017-06-01 14:39:13,10,2024-07-23 18:20:32,5,2025-05-20 23:05:12,2016-05-13 07:00:00,True,False,False,Hip-Hop/Rap
pick up the phone,Young Thug & Travis Scott,Travis Scott,"Jacques Webster II, Adam Feeney, ANDERSON HERNANDEZ, MIKE DEAN, Jeffery Williams, Allen Ritter, Quavious Marshall & Brittany Hazzard",Birds In The Trap Sing McKnight,Hip-Hop/Rap,8.5,4:12,11,14,2016,2017-06-01 14:39:39,12,2024-11-06 02:51:55,3,2018-09-28 11:35:00,2016-06-03 07:00:00,True,False,False,Hip-Hop/Rap
Money Longer,Lil Uzi Vert,Lil Uzi Vert,"Don Cannon, Lil Uzi Vert & Maaly Raw",Lil Uzi Vert Vs. The World,Hip-Hop,6.79,3:18,3,9,2016,2017-06-01 14:40:04,7,2024-10-04 08:14:39,4,2021-04-28 18:26:34,2016-02-06 08:00:00,True,False,False,Hip-Hop/Rap
X (feat. Future),21 Savage & Metro Boomin,21 Savage & Metro Boomin,Not Documented,Savage Mode,Rap,8.68,4:18,3,9,2016,2017-06-01 14:40:09,11,2025-02-10 18:40:12,2,2019-03-09 18:26:42,2016-07-14 07:00:00,True,False,False,Hip-Hop/Rap
White Iverson,Post Malone,Post Malone,Austin Post & Trocon Markous Roberts,Stoney (Deluxe),Hip-Hop/Rap,8.6,4:16,6,18,2015,2017-06-01 14:41:19,34,2024-08-30 20:21:06,12,2024-09-03 18:31:09,2015-08-14 07:00:00,True,True,False,Hip-Hop/Rap
Go Flex,Post Malone,Post Malone,"Austin Post, Ryan Vojtesak, Idan Kalai & Rex Kudo",Stoney (Deluxe),Hip-Hop/Rap,6.19,2:59,9,18,2016,2017-06-01 14:42:01,11,2024-06-06 03:07:36,7,2023-08-06 01:21:59,2016-04-21 07:00:00,True,False,False,Hip-Hop/Rap
One Dance (feat. Wizkid & Kyla),Drake,Drake,"Aubrey Drake Graham, Paul Jefferies, Noah ""40"" Shebib, Ayodeji Ibrahim Balogun & Kyla Smith",Views,Hip-Hop/Rap,5.9,2:53,12,20,2016,2017-06-01 14:42:10,13,2024-09-12 18:23:15,6,2023-07-11 14:12:55,2016-04-05 07:00:00,False,False,False,Hip-Hop/Rap
Controlla,Drake,Drake,"Aubrey Drake Graham, Matthew Jehu Samuels, D. Chin-Quee, A. Ritter, S. McGregor, Aquaman, M. Davis, D. Dennis, G. Jackson, P. Roberts & A. Thomas",Views,Hip-Hop/Rap,8.26,4:05,11,20,2016,2017-06-01 14:42:55,16,2025-07-11 15:23:35,4,2023-08-25 21:08:11,2016-04-29 07:00:00,True,False,False,Hip-Hop/Rap
Black Beatles (feat. Gucci Mane),Rae Sremmurd,Rae Sremmurd,"A.Brown, K. Brown, M. Williams & R. Davis",SremmLife 2 (Deluxe),Hip-Hop/Rap,9.71,4:51,5,14,2016,2017-06-01 14:43:22,13,2024-10-30 15:26:14,4,2024-09-13 19:15:27,2016-08-12 12:00:00,True,False,False,Hip-Hop/Rap
No Flockin,Kodak Black,Kodak Black,Kodak Black & Pan Rui Wen,No Flockin - Single,Hip-Hop,5.83,2:45,1,1,2014,2017-06-01 14:44:53,34,2024-10-27 22:03:52,5,2025-01-31 22:36:53,2014-07-06 07:00:00,True,True,False,Hip-Hop/Rap
Do What I Want,Lil Uzi Vert,Lil Uzi Vert,"Don Cannon, Lil Uzi Vert & Maaly Raw",The Perfect LUV Tape,Hip-Hop,6.11,2:55,1,10,2016,2017-06-01 14:45:26,13,2025-05-20 22:44:56,3,2023-09-06 05:28:42,2016-07-31 07:00:00,True,False,False,Hip-Hop/Rap
Low Life (feat. The Weeknd),Future,Future,"Nayvadius Wilburn, Abel Tesfaye, Benjamin Diehl, Daheala & Doc McKinney",EVOL,Hip-Hop/Rap,10.39,5:13,10,12,2016,2017-06-01 14:45:39,27,2025-01-05 05:16:28,11,2024-10-25 15:59:04,2016-02-06 08:00:00,True,False,False,Hip-Hop/Rap
Deja Vu,J. Cole,J. Cole,J. Cole,4 Your Eyez Only,Hip-Hop/Rap,8.75,4:26,3,10,2016,2017-06-01 14:46:01,15,2024-08-23 15:29:47,11,2024-09-20 20:24:05,2016-12-09 08:00:00,True,False,False,Hip-Hop/Rap
No Heart,21 Savage & Metro Boomin,21 Savage & Metro Boomin,Not Documented,Savage Mode,Rap,7.89,3:55,2,9,2016,2017-06-01 14:47:25,15,2025-05-01 00:09:16,9,2024-08-31 17:20:08,2016-07-15 07:00:00,True,False,False,Hip-Hop/Rap
Childs Play,Drake,Drake,"Aubrey Drake Graham, Noah ""40"" Shebib, L. T. Wayne, M. Morales, D. Robinson & D. Wimbley",Views,Hip-Hop/Rap,8.1,4:01,14,20,2016,2017-06-01 14:47:47,12,2025-05-20 20:53:58,5,2020-01-17 17:39:36,2016-04-29 07:00:00,True,False,False,Hip-Hop/Rap
through the late night,Travis Scott,Travis Scott,"Jacques Webster II, Ronald LaTour, Brock Korsan, Tim Gomringer, Kevin Gomringer, Scott Ramon Seguro Mescudi & Oladipo Omishore",Birds In The Trap Sing McKnight,Hip-Hop/Rap,9.56,4:46,4,14,2016,2017-06-01 14:53:26,13,2024-10-23 20:34:43,8,2024-09-01 19:53:50,2016-09-02 07:00:00,True,False,False,Hip-Hop/Rap
Too Good (feat. Rihanna),Drake,Drake,"Aubrey Drake Graham, R Fenty, P Jefferies, Maneesh Bidaye, D. Chin-Quee, A. Martin, A. Sutherland & A. Hershey",Views,Hip-Hop/Rap,8.71,4:23,16,20,2016,2017-06-01 14:58:24,31,2025-04-12 17:13:50,11,2024-05-12 21:27:08,2016-04-29 07:00:00,True,False,False,Hip-Hop/Rap
Too Many Years (feat. PnB Rock),Kodak Black,Kodak Black,,Lil Big Pac,Hip-Hop/Rap,6.7,3:16,7,13,2016,2017-06-01 14:58:44,17,2024-11-22 01:55:40,4,2020-04-29 17:26:13,2016-06-10 07:00:00,True,False,True,Hip-Hop/Rap
My Sh*t,A Boogie wit da Hoodie,A Boogie wit da Hoodie,Artist Julius Dubose & Daris Meachem,Artist,Hip-Hop/Rap,4.61,2:08,3,11,2016,2017-06-01 14:58:53,8,2025-03-30 02:42:37,2,2019-12-25 16:53:17,2016-07-01 07:00:00,True,False,False,Hip-Hop/Rap
Erase Your Social,Lil Uzi Vert,Lil Uzi Vert,"Don Cannon, Lil Uzi Vert & Lyle Leduff",The Perfect LUV Tape,Hip-Hop,6.9,3:19,8,10,2016,2017-06-01 14:59:14,31,2024-10-31 16:21:05,11,2023-12-31 04:45:13,2016-07-31 07:00:00,True,False,False,Hip-Hop/Rap
Rent Money,Future,Future,"Nayvadius Wilburn, Jevon A. Tate, Maurice Jordan Kenoe, Anthony Tucker & DJ Khaled",FUTURE,Hip-Hop/Rap,9.01,4:25,1,20,2017,2017-06-01 14:59:41,19,2025-07-03 02:02:54,6,2024-04-19 15:04:26,2017-02-17 08:00:00,True,False,False,Hip-Hop/Rap
Marvins Room,Drake,Drake,"Noah ""40"" Shebib, Aubrey Drake Graham & Adrian Eccleston",Take Care (Deluxe Version),Hip-Hop/Rap,11.34,5:47,6,20,2011,2017-06-01 15:00:15,12,2025-02-07 02:21:35,10,2025-01-18 22:02:12,2011-06-28 07:00:00,True,False,False,Hip-Hop/Rap
What the Price,Migos,Migos,"Quavious Marshall, Kiari Cephus, Kirshnick Ball, Ricky Harrell & William Gaskins",Culture,Hip-Hop/Rap,8.41,4:08,8,13,2017,2017-06-01 15:01:21,14,2024-05-22 15:52:32,2,2025-06-22 05:13:09,2017-01-20 12:00:00,True,False,False,Hip-Hop/Rap
Ps & Qs,Lil Uzi Vert,Lil Uzi Vert,Don Cannon & Lil Uzi Vert,Lil Uzi Vert Vs. The World,Hip-Hop,7.59,3:41,7,9,2016,2017-06-01 15:02:22,21,2024-09-13 15:39:12,5,2025-03-15 20:44:17,2016-04-15 07:00:00,True,False,False,Hip-Hop/Rap
100 Shots,Young Dolph,Young Dolph,,Bulletproof,Hip-Hop/Rap,8.9,4:24,1,10,2017,2017-06-01 15:03:38,8,2025-02-09 00:09:43,5,2024-04-13 23:14:11,2017-04-01 07:00:00,True,False,True,Hip-Hop/Rap
Feel No Ways,Drake,Drake,"Aubrey Drake Graham, J. Ullman, Noah ""40"" Shebib, N. Wilburn, A. Dudley & M. McLaren",Views,Hip-Hop/Rap,8.17,4:00,4,20,2016,2017-06-01 15:04:57,24,2025-06-05 18:14:23,13,2024-11-09 13:56:41,2016-04-29 07:00:00,True,True,False,Hip-Hop/Rap
Too Young,Post Malone,Post Malone,"Austin Post, Michael Hernandez, Carlos Suarez & Justin Mosley",Stoney (Deluxe),Hip-Hop/Rap,7.9,3:57,11,18,2015,2017-06-01 15:05:11,8,2024-11-06 01:27:06,6,2019-10-31 22:47:41,2015-10-09 07:00:00,True,False,False,Hip-Hop/Rap
Still Here,Drake,Drake,"Aubrey Drake Graham, D. Carter & Noah ""40"" Shebib",Views,Hip-Hop/Rap,6.51,3:09,10,20,2016,2017-06-01 15:06:56,29,2025-01-06 16:50:53,9,2023-07-12 14:15:46,2016-04-29 07:00:00,True,False,False,Hip-Hop/Rap
Antidote,Travis Scott,Travis Scott,"Jacques Webster II, Ebony Oshunrinde, Bryan Van Mierlo, Thomas Brenneck, David Guy, Leon Michels, Nicholas Movshon & Homer Steinweiss",Rodeo,Hip-Hop/Rap,8.83,4:22,9,16,2015,2017-06-01 15:07:32,13,2024-11-25 22:08:33,9,2024-06-03 11:27:06,2015-07-29 07:00:00,True,False,False,Hip-Hop/Rap
March Madness,Future,Future,Nayvadius Wilburn & Chance Youngblood,56 Nights,Hip-Hop/Rap,8.29,4:03,7,7,2015,2017-06-01 15:07:37,19,2025-05-09 19:43:37,4,2023-07-21 17:00:01,2015-03-21 12:00:00,True,False,False,Hip-Hop/Rap
Feds Did a Sweep,Future,Future,Nayvadius Wilburn & Xavier Dotson,FUTURE,Hip-Hop/Rap,8.95,4:30,17,20,2017,2017-06-01 15:08:27,27,2025-02-09 23:40:48,11,2022-10-29 18:26:02,2017-02-17 08:00:00,True,False,False,Hip-Hop/Rap
It Was a Good Day,Ice Cube,Ice Cube,Ice Cube,The Predator,Hip-Hop/Rap,8.72,4:19,7,16,1992,2017-06-01 16:54:13,17,2025-06-21 15:20:49,4,2023-06-25 20:30:39,1992-11-17 08:00:00,True,False,False,Hip-Hop/Rap
Goldie,A$AP Rocky,A$AP Rocky,Rakim Mayers & Chauncey Hollis,LONG.LIVE.A$AP (Deluxe Edition),Hip-Hop/Rap,6.59,3:12,2,17,2012,2017-06-01 22:09:56,25,2024-12-15 23:47:54,15,2024-02-28 06:16:59,2012-04-27 12:00:00,True,False,False,Hip-Hop/Rap
"F**kin' Problems (feat. Drake, 2 Chainz & Kendrick Lamar)",A$AP Rocky,A$AP Rocky,"Kendrick Lamar, Rakim Mayers, Noah ""40"" Shebib, Sean Garrett, Aubrey Drake Graham & Tauheed Epps",LONG.LIVE.A$AP (Deluxe Edition),Hip-Hop/Rap,7.83,3:53,7,17,2012,2017-06-01 22:10:06,30,2024-12-15 23:51:46,8,2023-02-18 18:00:45,2012-10-24 12:00:00,True,False,False,Hip-Hop/Rap
Alright,Kendrick Lamar,Kendrick Lamar,"K. Duckworth, P. Williams & M. Spears",To Pimp a Butterfly,Hip-Hop/Rap,7.45,3:39,7,16,2015,2017-06-02 12:57:26,19,2024-07-07 04:30:08,8,2023-06-02 17:31:42,2015-03-16 07:00:00,True,False,False,Hip-Hop/Rap
King Kunta,Kendrick Lamar,Kendrick Lamar,"K. Duckworth, M. Spears, J. Burns, D. Blake, M. Jackson, A. Lewis & S. Gordy",To Pimp a Butterfly,Hip-Hop/Rap,7.91,3:54,3,16,2015,2017-06-02 12:57:32,16,2024-12-31 22:06:02,9,2024-12-14 01:28:12,2015-03-16 07:00:00,True,False,False,Hip-Hop/Rap
She Knows (feat. Amber Coffman & Cults),J. Cole,J. Cole,J. Cole & Madeline Follin Mckenna,Born Sinner (Deluxe Version),Hip-Hop/Rap,10.29,4:56,8,21,2013,2017-06-02 12:57:48,20,2024-10-13 16:12:37,1,2023-09-11 20:05:34,2013-06-18 07:00:00,True,False,False,Hip-Hop/Rap
Antidote,Migos,Migos,"Quavious Marshall, Kirshnick Ball & Kiari Cephus",No Label II,Hip-Hop/Rap,7.62,3:42,6,20,2014,2017-06-02 12:59:06,14,2025-04-04 02:37:01,5,2025-03-18 13:59:00,2014-02-25 12:00:00,True,False,False,Hip-Hop/Rap
Planez (feat. J. Cole),Jeremih,Jeremih,"Jeremy Felton, ANDERSON HERNANDEZ, Adam Woods, J. Cole, Adam Feenly, Akinyele Adams, Reginald Harris & Kia Jeffries",Late Nights,R&B/Soul,8.05,4:00,1,15,2015,2017-06-02 13:00:03,37,2025-06-15 23:10:31,9,2025-05-15 23:00:08,2015-01-22 08:00:00,True,True,False,R&B/Soul
Too Much Sauce (feat. Future & Lil Uzi Vert),DJ ESCO,DJ ESCO,"William Moore, Xavier Dotson, Nayvadius Wilburn & Symere Woods",Too Much Sauce (feat. Future & Lil Uzi Vert) - Single,Hip-Hop/Rap,7.47,3:43,1,1,2016,2017-06-02 13:01:26,15,2025-02-10 01:19:26,8,2025-01-19 00:06:22,2016-08-19 07:00:00,True,False,False,Hip-Hop/Rap
Stick Talk,Future,Future,Nayvadius Wilburn & Joshua Luellen,DS2 (Deluxe),Rap,5.99,2:51,6,17,2015,2017-06-02 13:02:04,16,2024-06-17 17:42:42,3,2021-03-21 02:37:06,2015-07-17 07:00:00,True,False,False,Hip-Hop/Rap
2 Phones,Kevin Gates,Kevin Gates,"Brittany Hazzard, Kevin Gilyard & Rick Witherspoon Jr.",Islah (Deluxe),Hip-Hop/Rap,8.41,4:00,3,17,2015,2017-06-02 13:03:52,11,2025-03-28 20:36:14,8,2025-02-01 21:08:36,2015-12-11 08:00:00,True,False,False,Hip-Hop/Rap
Why You Always Hatin? (feat. Drake & Kamaiyah),YG,YG,"Keenon Jackson, Aubrey Drake Graham, Clarence Thomas, Kamaiyah Johnson, August Moon & Tyrone Thomas",Still Brazy (Deluxe),Hip-Hop/Rap,6.8,3:16,9,17,2016,2017-06-02 13:04:24,11,2024-12-14 01:27:37,5,2024-08-23 18:23:27,2016-05-21 12:00:00,True,False,False,Hip-Hop/Rap
Blasé (feat. Future & Rae Sremmurd),Ty Dolla $ign,Ty Dolla $ign,"DJ Spinz, Future, Marquis Medina, Slim Jxmmi, Swae Lee & Ty Dolla $ign",Free TC (Deluxe Edition),Hip-Hop/Rap,9.62,4:45,12,19,2015,2017-06-02 13:04:52,21,2025-01-05 05:51:33,6,2024-11-06 01:49:53,2015-06-26 12:00:00,True,False,False,Hip-Hop/Rap
Cut It (feat. Young Dolph),O.T. Genasis,O.T. Genasis,"Adolph Thornton Jr., Montre Edmonds & Odis Oliver Flores",Cut It (feat. Young Dolph) - Single,Hip-Hop/Rap,7.61,3:42,1,1,2015,2017-06-02 13:05:08,13,2024-06-13 13:50:39,5,2024-08-12 00:51:49,2015-09-25 07:00:00,True,False,False,Hip-Hop/Rap
"Flex (Ooh, Ooh, Ooh)",Rich Homie Quan,Rich Homie Quan,,"Flex (Ooh, Ooh, Ooh) - Single",Hip-Hop/Rap,6.09,2:56,1,1,2015,2017-06-02 13:06:29,26,2025-01-10 22:52:37,4,2022-12-14 18:47:09,2015-02-10 08:00:00,True,False,False,Hip-Hop/Rap
This Could Be Us,Rae Sremmurd,Rae Sremmurd,"M. Williams, A.Brown, K. Brown & M. Middlebrooks",SremmLife,Hip-Hop/Rap,7.13,3:26,5,11,2015,2017-06-02 13:07:25,14,2024-09-04 15:22:30,2,2018-08-30 20:42:47,2015-01-06 08:00:00,True,False,False,Hip-Hop/Rap
m.A.A.d city (feat. MC Eiht),Kendrick Lamar,Kendrick Lamar,"Kendrick Duckworth, M. Spears, R Riera, A. Morgan & A. Tyler","good kid, m.A.A.d city (Deluxe Version)",Hip-Hop/Rap,11.57,5:50,8,18,2012,2017-06-02 13:07:38,14,2025-03-18 05:28:51,10,2025-02-01 21:31:46,2012-10-22 07:00:00,True,False,False,Hip-Hop/Rap
Poetic Justice (feat. Drake),Kendrick Lamar,Kendrick Lamar,"Kendrick Duckworth, E. Molina, Aubrey Drake Graham, J. Harris, J. Jackson & T. Lewis","good kid, m.A.A.d city (Deluxe Version)",Hip-Hop/Rap,9.98,5:00,6,18,2012,2017-06-02 13:09:25,22,2024-07-23 23:08:14,4,2019-02-16 16:59:28,2012-10-22 07:00:00,True,False,False,Hip-Hop/Rap
Check,Young Thug,Young Thug,Jeffery Williams & London Holmes,Barter 6,Hip-Hop/Rap,7.78,3:50,4,13,2015,2017-06-02 13:11:06,42,2024-10-15 22:54:22,16,2024-08-23 21:42:55,2015-04-01 07:00:00,True,True,False,Hip-Hop/Rap
Wicked,Future,Future,"Nayvadius Wilburn, Leland Wayne, Joshua Luellen & Denis Ozcan",EVOL,Hip-Hop/Rap,6.0,2:53,12,12,2016,2017-06-02 13:12:22,14,2024-10-11 15:49:59,5,2024-01-19 21:37:45,2016-02-06 08:00:00,True,False,False,Hip-Hop/Rap
Top,Lil Uzi Vert,Lil Uzi Vert,"Don Cannon, Lil Uzi Vert & Treez Lowkey",Luv Is Rage,Hip-Hop,8.04,3:56,7,12,2015,2017-06-02 13:14:15,12,2024-06-11 18:22:00,3,2019-03-26 22:25:14,2015-10-30 07:00:00,True,False,False,Hip-Hop/Rap
New Level (feat. Future),A$AP Ferg,A$AP Ferg,"Darold Brown, Carlton Mays Jr. & Nayvadius Wilburn",ALWAYS STRIVE AND PROSPER,Hip-Hop/Rap,9.08,4:24,7,19,2015,2017-06-02 13:16:01,21,2024-07-19 23:18:20,3,2024-04-03 23:22:06,2015-12-18 08:00:00,True,False,False,Hip-Hop/Rap
Cocoon,Migos,Migos,"Quavious Marshall, Kiari Cephus & Kirshnick Ball",Cocoon - Single,Hip-Hop/Rap,9.85,4:57,1,1,2016,2017-06-02 13:16:44,19,2025-04-22 04:08:52,2,2019-08-14 17:08:41,2016-05-05 12:00:00,True,False,False,Hip-Hop/Rap
Memo,Young Thug,Young Thug,Jeffrey Williams & London Holmes,Slime Season 3,Hip-Hop,6.72,3:15,2,8,2016,2017-06-02 13:17:18,14,2025-05-04 15:01:44,3,2024-05-11 19:33:15,2016-03-25 07:00:00,True,False,False,Hip-Hop/Rap
Crooked Smile (feat. TLC),J. Cole,J. Cole,"J. Cole, Meleni Smith & Rich Harrison",Born Sinner (Deluxe Version),Hip-Hop/Rap,9.5,4:38,14,21,2013,2017-06-02 13:17:56,13,2024-09-05 02:11:24,5,2024-04-29 02:51:00,2013-06-04 12:00:00,True,False,False,Hip-Hop/Rap
Express Yourself,N.W.A,N.W.A,C. Wright & O. Jackson,Straight Outta Compton,Hip-Hop/Rap,8.88,4:25,8,13,1988,2017-06-02 13:23:37,13,2025-01-14 21:48:20,5,2025-01-04 22:51:00,1988-08-08 07:00:00,True,False,False,Hip-Hop/Rap
I'm Me,Lil Wayne,Lil Wayne,"D.Carter, L. Mollings & J. Mollings",The Leak - EP,Hip-Hop/Rap,9.82,4:55,1,5,2007,2017-06-02 13:25:20,38,2025-03-10 18:34:39,10,2024-10-11 23:41:38,2007-12-25 08:00:00,True,True,False,Hip-Hop/Rap
A Milli,Lil Wayne,Lil Wayne,"D. Carter, S. Crawford, Kamaal Fareed & Ali Shaheed Jones-Muhammad",Tha Carter III,Hip-Hop/Rap,7.59,3:41,3,18,2008,2017-06-02 13:25:30,33,2025-03-10 16:32:59,10,2024-04-19 15:31:58,2008-04-23 07:00:00,True,False,False,Hip-Hop/Rap
California Love (feat. Roger Troutman & Dr. Dre),2Pac,2Pac,"Roger Troutman, Norman Durham, Mikel Hooks, Dr. Dre, Ronnie Hudson, Larry Troutman, 2Pac & Woody Cunningham",Greatest Hits,Hip-Hop/Rap,9.9,4:44,6,13,1998,2017-06-02 13:25:59,18,2025-01-05 03:48:17,6,2025-02-09 17:47:03,1998-11-24 08:00:00,True,False,False,Hip-Hop/Rap
Straight Outta Compton,N.W.A,N.W.A,"O'Shea Jackson, Lorenzo Patterson, Eric Wright & Dr. Dre",Straight Outta Compton,Hip-Hop/Rap,8.65,4:18,1,13,1988,2017-06-02 13:26:25,16,2025-05-20 22:54:55,6,2023-09-16 18:58:13,1988-07-10 07:00:00,True,False,False,Hip-Hop/Rap
Gangsta Gangsta,N.W.A,N.W.A,"Steven R Arrington, Leroy Bonner, Charles C. Carter, William DeVaughn, Buddy Hankerson, O'Shea Jackson, Marshall Eugene Jones, Ralph Middlebrook, Walter Morrison, Norman Bruce Napier, Andrew Noland, Roger Parker, Lorenzo Patterson, Marvin R. Pierce, Grego",Straight Outta Compton,Hip-Hop/Rap,11.2,5:36,3,13,1988,2017-06-02 13:28:20,6,2024-06-17 12:47:55,4,2020-04-29 16:51:18,1988-08-08 07:00:00,True,False,False,Hip-Hop/Rap
Still D.R.E. (feat. Snoop Dogg),Dr. Dre,Dr. Dre,"Andre R. Young, Melvin Charles Bradford, Shawn Carter & Scott Storch",2001,Hip-Hop/Rap,9.13,4:30,4,23,1999,2017-06-02 13:30:53,16,2025-01-13 15:57:06,8,2023-08-22 20:58:47,1999-10-13 07:00:00,True,False,False,Hip-Hop/Rap
Changes (feat. Talent),2Pac,2Pac,"Bruce Hornsby, 2Pac & Dion Evans",Greatest Hits,Hip-Hop/Rap,9.1,4:28,5,13,1998,2017-06-02 13:31:28,12,2024-11-05 16:09:14,5,2022-12-11 19:28:22,1998-10-13 07:00:00,True,False,False,Hip-Hop/Rap
Drove U Crazy (feat. Bryson Tiller),Gucci Mane,Gucci Mane,"Bryson Tiller, Ozan Yildirim & Radric Davis",The Return of East Atlanta Santa,Hip-Hop/Rap,6.58,3:09,6,13,2016,2017-06-02 13:33:09,19,2024-10-06 06:56:25,7,2024-11-19 04:31:07,2016-12-02 08:00:00,True,False,False,Hip-Hop/Rap
Regulate,Warren G,Warren G,Nathaniel Hale,Regulate… G Funk Era (Special Edition),Hip-Hop/Rap,8.35,4:08,1,12,1994,2017-06-02 13:36:06,26,2025-03-15 22:27:29,6,2025-02-09 16:30:48,1994-04-28 07:00:00,True,False,False,Hip-Hop/Rap
Where Ya At (feat. Drake),Future,Future,"Nayvadius Wilburn, Leland Wayne & Aubrey Drake Graham",DS2 (Deluxe),Hip-Hop/Rap,7.13,3:28,3,17,2015,2017-06-02 13:38:28,32,2025-01-31 00:31:01,10,2024-11-05 20:24:53,2015-07-17 07:00:00,True,False,False,Hip-Hop/Rap
Grammys (feat. Future),Drake,Drake,"Aubrey Drake Graham, Noah ""40"" Shebib, Joshua Luellen, Ronald LaTour, D. Jackson & N. Wilburn",Views,Hip-Hop/Rap,7.32,3:40,13,20,2016,2017-06-02 13:38:33,14,2024-08-21 00:53:29,2,2018-03-02 04:27:15,2016-04-29 07:00:00,True,False,False,Hip-Hop/Rap
Diamonds Dancing,Drake & Future,Drake & Future,"Aubrey Drake Graham, Nayvadius Wilburn, Leland Wayne, Allen Ritter & Adam Feeney",What a Time To Be Alive,Hip-Hop/Rap,10.33,5:14,4,11,2015,2017-06-02 13:39:31,10,2024-11-09 13:55:29,3,2019-03-01 01:29:16,2015-09-20 07:00:00,True,False,False,Hip-Hop/Rap
Live From the Gutter,Drake & Future,Drake & Future,"Aubrey Drake Graham, Nayvadius Wilburn, Leland Wayne & Matthew Jehu Samuels",What a Time To Be Alive,Hip-Hop/Rap,7.11,3:31,3,11,2015,2017-06-02 13:39:49,10,2025-04-23 20:08:37,3,2023-08-25 23:52:27,2015-09-20 07:00:00,True,False,False,Hip-Hop/Rap
Jersey,Future,Drake & Future,"Nayvadius Wilburn, Leland Wayne & Joshua Luellen",What a Time To Be Alive,Hip-Hop/Rap,6.39,3:08,10,11,2015,2017-06-02 13:40:17,19,2025-01-18 21:34:52,3,2020-02-06 21:57:59,2015-09-20 07:00:00,True,True,False,Hip-Hop/Rap
Change Locations,Drake & Future,Drake & Future,"Aubrey Drake Graham, Nayvadius Wilburn & Noel",What a Time To Be Alive,Hip-Hop/Rap,7.34,3:40,8,11,2015,2017-06-02 13:40:28,12,2025-02-06 20:37:49,7,2025-02-01 21:04:13,2015-09-20 07:00:00,True,False,False,Hip-Hop/Rap
Immortal,J. Cole,J. Cole,J. Cole,4 Your Eyez Only,Hip-Hop/Rap,6.82,3:20,2,10,2016,2017-06-02 13:40:59,17,2024-12-29 23:19:46,5,2023-06-11 19:46:30,2016-12-09 08:00:00,True,False,False,Hip-Hop/Rap
Neighbors,J. Cole,J. Cole,J. Cole,4 Your Eyez Only,Hip-Hop/Rap,7.41,3:36,7,10,2016,2017-06-02 13:41:10,73,2025-03-15 22:20:23,9,2023-08-30 03:27:10,2016-12-09 08:00:00,True,True,False,Hip-Hop/Rap
Power Trip (feat. Miguel),J. Cole,J. Cole,J. Cole & Hubert Laws,Born Sinner (Deluxe Version),Hip-Hop/Rap,8.16,4:01,4,21,2013,2017-06-02 13:42:06,46,2025-05-20 21:07:20,11,2024-04-30 05:11:41,2013-02-14 12:00:00,True,True,False,Hip-Hop/Rap
Can't Get Enough (feat. Trey Songz),J. Cole,J. Cole,"J. Cole, Ibrahima Kouyate & Emile Soumah",Cole World: The Sideline Story,R&B/Soul,7.81,3:45,3,18,2011,2017-06-02 13:42:32,14,2025-03-28 20:15:48,8,2022-02-17 07:46:36,2011-09-27 12:00:00,False,False,False,R&B/Soul
In the Morning (feat. Drake),J. Cole,J. Cole,J. Cole & Aubrey Drake Graham,Cole World: The Sideline Story,Hip-Hop/Rap,7.99,3:54,9,18,2011,2017-06-02 13:44:46,23,2024-10-19 21:18:46,5,2024-01-13 16:25:55,2011-09-27 12:00:00,False,False,False,Hip-Hop/Rap
Tom Ford,JAY-Z,JAY-Z,"S. Carter, Timothy Mosley & J. Harmon",Magna Carta... Holy Grail,Hip-Hop/Rap,6.48,3:09,3,16,2013,2017-06-02 13:50:38,20,2024-12-16 20:10:12,9,2023-12-31 20:14:18,2013-07-04 07:00:00,True,False,False,Hip-Hop/Rap
F*ckwithmeyouknowigotit (feat. Rick Ross),JAY-Z,JAY-Z,"S. Carter, Matthew Jehu Samuels, A. Hernandez & W. Roberts",Magna Carta... Holy Grail,Hip-Hop/Rap,8.17,4:03,4,16,2013,2017-06-02 13:51:01,26,2025-03-29 21:10:32,6,2021-07-27 21:58:59,2013-07-04 07:00:00,True,False,False,Hip-Hop/Rap
Dirt Off Your Shoulder,JAY-Z,JAY-Z,Shawn Carter & Timothy Mosley,The Black Album,Hip-Hop/Rap,8.44,4:05,6,14,2003,2017-06-02 13:51:41,15,2025-03-10 17:50:59,3,2024-12-14 01:27:47,2003-11-14 08:00:00,True,False,False,Hip-Hop/Rap
"Bitch, Don’t Kill My Vibe",Kendrick Lamar,Kendrick Lamar,"Kendrick Duckworth, M. Spears, Braun, Vindahl Friis & Liv Lykke Schmidt","good kid, m.A.A.d city (Deluxe Version)",Hip-Hop/Rap,10.41,5:10,2,18,2012,2017-06-02 13:55:42,36,2024-07-06 12:40:36,12,2024-09-14 18:29:45,2012-10-22 07:00:00,True,False,False,Hip-Hop/Rap
Backseat Freestyle,Kendrick Lamar,Kendrick Lamar,Kendrick Duckworth & C. Hollis,"good kid, m.A.A.d city (Deluxe Version)",Hip-Hop/Rap,7.32,3:32,3,18,2012,2017-06-02 13:55:43,14,2024-09-13 19:02:12,9,2024-02-11 17:30:29,2012-10-22 07:00:00,True,False,False,Hip-Hop/Rap
Money Trees (feat. Jay Rock),Kendrick Lamar,Kendrick Lamar,"Kendrick Duckworth, D. Natche, J. McKinzie, V. Garance, A. Legrand & Alex Scally","good kid, m.A.A.d city (Deluxe Version)",Hip-Hop/Rap,12.8,6:26,5,18,2012,2017-06-02 13:55:46,43,2025-05-03 16:09:34,14,2025-05-03 16:09:49,2012-10-22 07:00:00,True,True,False,Hip-Hop/Rap
