Int'l Players Anthem (I Choose You) [feat. Outkast],UGK,UGK,"Paul Beauregard, Chad Butler, Bernard Freeman, Jordan Houston, André Benjamin & Antwan Patton",UGK (Underground Kingz),Hip-Hop/Rap,8.81,4:19,2,13,2007,2021-12-12 01:07:47,6,2024-12-20 18:53:42,2,2023-04-05 06:27:12,2007-06-06 07:00:00,True,False,False,Hip-Hop/Rap
Welcome to Atlanta (feat. Ludacris),Jermaine Dupri,Jermaine Dupri,"Jermaine Dupri, Christopher Bridges, Christine Yarian, Freddie Perren, Jalil Hutchins, John Fletchers & Larry Smith",Instructions,R&B/Soul,7.06,3:20,2,20,2001,2021-12-12 01:09:02,3,2024-07-16 11:55:22,2,2022-10-31 23:06:02,2001-09-25 12:00:00,True,False,False,R&B/Soul
Poppin' My Collar (feat. Project Pat),Three 6 Mafia featuring Project Pat,Three 6 Mafia,"Paul Beauregard, Jordan Houston, Darnell Carlton, Donald Pears & Willie Hutchinson",Most Known Unknown (Bonus Tracks),Hip-Hop/Rap,6.23,2:56,7,22,2005,2021-12-12 01:11:00,9,2025-05-08 03:39:51,2,2024-11-08 17:26:34,2005-09-27 07:00:00,True,False,False,Hip-Hop/Rap
What's Luv? (feat. Ja-Rule & Ashanti),Fat Joe,Fat Joe,"A. Parker, C. Rios, I. Lorenzo, J. Cartagena & J.Atkins",Jealous Ones Still Envy (J.O.S.E),Hip-Hop/Rap,9.18,4:27,9,18,2001,2021-12-12 01:12:10,5,2024-09-06 20:56:48,7,2023-12-18 23:09:06,2001-12-04 08:00:00,True,False,False,Hip-Hop/Rap
Moment 4 Life (feat. Drake),Nicki Minaj,Nicki Minaj,"Nikhil Seetharam, Tyler Williams, Aubrey Drake Graham & Onika Maraj",Pink Friday (Complete Edition),Hip-Hop/Rap,9.5,4:39,7,21,2010,2021-12-15 20:46:22,4,2025-05-18 15:00:47,2,2023-08-11 18:32:28,2010-11-22 08:00:00,True,False,False,Hip-Hop/Rap
Chosen (feat. Ty Dolla $ign),Blxst & Tyga,Blxst,"Christopher Wilson, Jared William Grace, Matthew Burdette, Michael Ray & Tyrone Griffin",No Love Lost (Deluxe),Hip-Hop/Rap,5.69,2:41,12,14,2020,2021-12-22 00:26:21,13,2025-07-04 22:43:16,2,2024-04-10 02:51:18,2020-12-04 12:00:00,True,False,False,Hip-Hop/Rap
Scenic Drive (feat. Ari Lennox & Smino),Khalid,Khalid,"Khalid Robinson, Kenneth Blume, Nathan Perez, Courtney Salter & Christopher Smith Jr.",Scenic Drive (The Tape),R&B/Soul,8.45,4:09,9,9,2021,2021-12-22 00:27:46,26,2024-08-03 20:10:39,7,2024-08-23 21:26:57,2021-12-02 12:00:00,True,False,False,R&B/Soul
Stretch It,JB Scofield,JB Scofield,JB Scofield,Stretch It - Single,Hip-Hop/Rap,6.43,3:08,1,1,2019,2021-12-22 19:51:29,12,2024-12-15 20:55:41,1,2024-12-06 19:10:53,2019-06-03 12:00:00,False,False,False,Hip-Hop/Rap
Screwin,Summer Walker & Omarion,Summer Walker,"Summer Walker, Omari Grandberry, Darhyl Camper, Jr., Sean Garrett, London Holmes, Greg Curtis & Cooper Douglas McGill",Still Over It,R&B/Soul,11.32,5:33,15,20,2021,2021-12-24 05:21:18,11,2025-04-04 02:50:35,2,2022-10-25 19:30:43,2021-11-05 12:00:00,True,False,False,R&B/Soul
On the Way (feat. Mila J),Jhené Aiko,Jhené Aiko,"Jhené Aiko, BRIAN KEITH WARFIELD, Maclean Robinson, Julian-Quan Viet Le & Jamila Chilombo",Chilombo (Deluxe Edition),R&B/Soul,7.54,3:42,26,29,2020,2021-12-24 05:22:01,8,2025-06-22 04:41:36,4,2025-06-22 04:35:19,2020-07-17 07:00:00,True,False,False,R&B/Soul
Woah Woah (feat. Young Thug & Gunna),Mustard,Mustard,"Dijon McFarlane, Quintin Gulledge, Justus West, Jeffery Lamar Williams & Sergio Kitchens",Perfect Ten,Hip-Hop/Rap,7.92,3:51,7,10,2019,2021-12-24 05:24:21,35,2024-08-14 15:56:27,11,2025-02-19 19:00:50,2019-06-28 07:00:00,True,False,False,Hip-Hop/Rap
Secret (feat. Summer Walker),21 Savage,21 Savage,"Shéyaa Bin Abraham-Joseph, Summer Walker, Ahmar Bailey, Jermaine Dupri, LaTocha Scott & Manuel Lonnie Seal Jr",Secret (feat. Summer Walker) - Single,R&B/Soul,7.24,3:30,1,1,2020,2021-12-24 05:31:26,7,2024-11-06 02:17:04,3,2023-03-13 23:34:01,2020-04-17 12:00:00,True,False,False,R&B/Soul
Fire & Desire,Drake,Drake,"Noah ""40"" Shebib, Jeff Young, Curtis Wilson, Rochad Holiday, Brandy Norwood & Aubrey Drake Graham",Views,Hip-Hop/Rap,8.01,3:58,18,20,2016,2021-12-24 05:32:11,18,2024-12-18 14:48:27,1,2021-12-27 17:42:54,2016-04-29 12:00:00,True,False,False,Hip-Hop/Rap
Calling My Phone,Lil Tjay & 6LACK,Lil Tjay & 6LACK,"Lil Tjay, Ricardo Valdez Valentine Jr., Ryan Martinez, Luis Campozano, Brendan Walsh & Henock Siyoum",Calling My Phone - Single,Hip-Hop/Rap,6.96,3:25,1,1,2021,2021-12-24 05:36:39,8,2025-02-26 18:54:24,3,2022-04-28 17:58:03,2021-02-12 12:00:00,True,False,False,Hip-Hop/Rap
Redbone,Childish Gambino,Childish Gambino,Donald Glover & Ludwig Göransson,"""Awaken, My Love!""",Hip-Hop/Rap,11.17,5:26,6,11,2016,2021-12-25 07:07:39,23,2025-04-23 19:05:39,8,2025-02-19 18:39:00,2016-11-17 12:00:00,True,False,False,Hip-Hop/Rap
Around the Way Girl,LL COOL J,LL COOL J,James Todd Smith & Marlon Williams,All World: Greatest Hits,Hip-Hop/Rap,8.3,4:04,10,16,1990,2021-12-25 07:13:31,7,2025-05-21 02:13:36,4,2023-12-30 20:27:56,1990-08-20 12:00:00,False,False,False,Hip-Hop/Rap
Incredible,Future,Future,Nayvadius Wilburn & Andre Eric Proctor,HNDRXX,Hip-Hop/Rap,8.41,4:08,6,19,2017,2021-12-25 07:16:38,11,2025-03-29 00:44:59,0,,2017-02-24 08:00:00,True,False,False,Hip-Hop/Rap
Selfish (feat. Rihanna),Future,Future,"Nayvadius Wilburn, Noel Fisher, Daniel Mizrahi, Omar Walker & Robyn Rihanna Fenty",HNDRXX,Hip-Hop/Rap,8.54,4:11,15,19,2017,2021-12-25 07:19:04,7,2025-05-18 15:10:47,2,2023-03-03 19:46:46,2017-02-24 08:00:00,True,False,False,Hip-Hop/Rap
ROS,Mac Miller,Mac Miller,"Adam Feeney, Dacoury Natche, Gabrielle Varner, Malcolm McCormick & Thomas Paxton-Beesley",GO:OD AM,Hip-Hop,11.38,5:43,13,17,2015,2021-12-25 07:28:11,17,2025-01-04 22:10:54,3,2024-04-27 12:42:05,2015-09-18 07:00:00,True,False,False,Hip-Hop/Rap
How To Love,Lil Wayne,Lil Wayne,"D. Carter, N. Fisher, LaNelle Seymour & Jermaine Preyan",Tha Carter IV (Complete Edition),Hip-Hop/Rap,8.19,4:00,12,21,2011,2021-12-25 07:28:38,5,2025-03-02 23:52:40,0,,2011-05-26 12:00:00,False,False,False,Hip-Hop/Rap
While We're Young,Jhené Aiko,Jhené Aiko,"Jhené Aiko, BRIAN KEITH WARFIELD, Maclean Robinson & Clams Casino",Trip,R&B/Soul,8.03,3:56,3,22,2017,2021-12-25 07:30:33,40,2025-06-04 15:10:44,4,2024-09-14 17:35:14,2017-06-09 12:00:00,True,False,False,R&B/Soul
I Know What You Want (feat. Flipmode Squad),Busta Rhymes & Mariah Carey,Busta Rhymes,"Trevor Smith, William Lewis, Roger McNair, Leroy Jones, Rashia Fisher & Ricardo Thomas",It Ain't Safe No More...,Hip-Hop/Rap,10.8,5:24,12,19,2002,2021-12-25 07:31:30,4,2024-12-15 20:30:24,1,2022-10-28 04:39:46,2002-11-26 08:00:00,True,False,False,Hip-Hop/Rap
Heebiejeebies (feat. Kehlani) [Bonus],Aminé,Aminé,"Adam Daniel, Jahaan Sweet, Kehlani & Sean Rhoden",Good For You,Hip-Hop/Rap,7.71,3:40,15,15,2017,2021-12-25 07:32:19,9,2025-04-12 01:19:47,0,,2017-05-26 12:00:00,True,False,False,Hip-Hop/Rap
Lemonade,Gucci Mane,Gucci Mane,"Howard Kaylan, Mark Volman, Radric Davis & Shondrae Crawford",The State vs. Radric Davis (Deluxe),Hip-Hop/Rap,8.42,4:06,6,27,2009,2021-12-25 08:04:15,6,2025-01-31 21:00:30,2,2024-05-12 17:12:42,2009-12-07 08:00:00,True,False,False,Hip-Hop/Rap
Mirror (feat. Bruno Mars),Lil Wayne,Lil Wayne,"D. Carter, Peter Gene Hernandez, P. Lawrence & Ross Owen",Tha Carter IV (Complete Edition),Hip-Hop/Rap,7.81,3:48,17,21,2011,2021-12-25 08:16:48,4,2025-04-04 01:41:54,4,2024-04-20 03:49:04,2011-08-29 12:00:00,True,False,False,Hip-Hop/Rap
Heart & Soul,YoungBoy Never Broke Again & Birdman,Birdman & YoungBoy Never Broke Again,Kentrell D Gaulden,From The Bayou,Hip-Hop/Rap,7.75,3:49,9,13,2021,2021-12-26 00:29:46,15,2025-01-05 05:42:17,7,2024-03-24 04:56:57,2021-12-02 08:00:00,True,False,False,Hip-Hop/Rap
Everything (feat. John Legend),Ella Mai,Ella Mai,"Ella Mai, Dayyon Alexander, Jeff Shum, Dijon McFarlane & Quintin Gulledge",Ella Mai,R&B/Soul,6.28,3:01,9,15,2018,2021-12-27 03:39:19,15,2024-11-11 02:25:40,0,,2018-10-12 12:00:00,False,False,False,R&B/Soul
Stack House (feat. Future),Zona Man,Zona Man,,No Advance 2,Hip-Hop/Rap,5.52,2:39,4,13,2021,2021-12-29 00:36:58,11,2024-06-27 23:14:58,3,2025-07-04 12:43:57,2021-12-24 12:00:00,True,False,True,Hip-Hop/Rap
Come On,Jhené Aiko,Jhené Aiko,"Jhené Aiko, BRIAN KEITH WARFIELD, Maclean Robinson & Julian-Quan Viet Le",Chilombo (Deluxe Edition),R&B/Soul,5.48,2:34,25,29,2020,2021-12-30 19:29:28,9,2024-06-06 12:17:56,3,2025-07-04 13:04:44,2020-07-17 07:00:00,True,False,False,R&B/Soul
What's On Your Mind (feat. Jacquees),K CAMP,K CAMP,"Kristopher Campbell, Rodriquez Broadnax, Forte Bowie, Kelvin Brown & Brandon Black",Kiss 5 (Deluxe),Hip-Hop/Rap,7.92,3:51,3,20,2020,2021-12-31 19:03:30,7,2025-01-08 10:42:12,2,2023-05-24 13:27:51,2020-04-24 12:00:00,True,False,False,Hip-Hop/Rap
Why You Lying,9lokknine,9lokknine,Jacquavius Smith,Why You Lying - Single,Hip-Hop/Rap,7.46,3:44,1,1,2020,2022-01-06 22:30:01,12,2025-02-12 19:10:18,2,2024-07-20 22:25:34,2020-05-29 12:00:00,True,False,False,Hip-Hop/Rap
thought i was playing,Gunna & 21 Savage,Gunna,"Michael Len Williams II, Sergio Kitchens & Shéyaa Bin Abraham-Joseph",DRIP SEASON 4EVER,Hip-Hop/Rap,5.86,2:47,5,20,2022,2022-01-18 08:39:57,7,2025-03-11 04:18:21,3,2024-08-21 19:03:54,2022-01-07 12:00:00,True,False,False,Hip-Hop/Rap
P power (feat. Drake),Gunna,Gunna,"Aubrey Drake Graham, Barry Manilow, Leland Wayne & Sergio Kitchens",DRIP SEASON 4EVER,Hip-Hop/Rap,6.66,3:13,6,20,2022,2022-01-18 08:39:58,10,2025-04-12 19:59:49,2,2023-04-01 21:07:02,2022-01-13 08:00:00,True,False,False,Hip-Hop/Rap
25k jacket (feat. Lil Baby),Gunna,Gunna,"Nik Dean, Sergio Kitchens & Wesley Glass",DRIP SEASON 4EVER,Hip-Hop/Rap,4.29,2:00,12,20,2022,2022-01-18 08:40:37,13,2025-02-14 17:43:59,3,2022-10-08 19:51:04,2022-01-07 12:00:00,True,False,False,Hip-Hop/Rap
flooded,Gunna,Gunna,Sergio Kitchens & Young Twix,DRIP SEASON 4EVER,Hip-Hop/Rap,5.27,2:32,15,20,2022,2022-01-18 08:40:44,3,2024-07-29 01:32:20,1,2024-08-23 23:02:00,2022-01-07 12:00:00,True,False,False,Hip-Hop/Rap
so far ahead > empire,Gunna,Gunna,"Alex Bak, Chandler Durham, Sergio Kitchens & Taurus Currie Jr.",DRIP SEASON 4EVER,Hip-Hop/Rap,11.23,5:37,19,20,2022,2022-01-18 08:40:50,28,2025-03-03 20:23:50,8,2024-10-25 16:31:45,2022-01-07 12:00:00,True,False,False,Hip-Hop/Rap
2009,Mac Miller,Mac Miller,"Aja Grant, Chanté Moore, Eric Gabouer, George Jackson, James Harris, James Wright, Jon Brion, Malcolm McCormick & Terry Lewis",Swimming,Hip-Hop/Rap,11.6,5:48,12,13,2018,2022-01-18 08:50:17,20,2025-06-05 18:27:15,9,2025-05-17 19:15:25,2018-08-03 12:00:00,True,False,False,Hip-Hop/Rap
Dang! (feat. Anderson .Paak),Mac Miller,Mac Miller,"Anderson .Paak, David Pimentel & Malcolm McCormick",The Divine Feminine,Hip-Hop,10.17,5:05,2,10,2016,2022-01-18 08:51:31,26,2025-07-09 21:40:40,6,2024-11-03 20:35:17,2016-07-28 07:00:00,True,False,False,Hip-Hop/Rap
Gimme the Loot (2005 Remaster),The Notorious B.I.G.,The Notorious B.I.G.,"Ali-Shaheed Jones-Muhammad, Bryan Higgins, Chris Martin, Fred Scruggs, James Jackson, Kamaal Ibn John Fareed, Keith Elam, Kirk Jones, Malik Izaak Taylor, The Notorious B.I.G., Osten Harvey, Trevor G Smith Jr & Tyrone Taylor",Ready to Die (The Remaster),Hip-Hop/Rap,10.65,4:45,3,19,1994,2022-01-21 09:40:33,16,2025-06-05 18:10:09,3,2025-02-26 02:39:50,1994-09-13 07:00:00,True,False,False,Hip-Hop/Rap
Juicy (2005 Remaster),The Notorious B.I.G.,The Notorious B.I.G.,"James Mtume, Jean Claude Oliver, The Notorious B.I.G. & Sean ""Puffy"" Combs",Ready to Die (The Remaster),Hip-Hop/Rap,10.81,5:02,10,19,1994,2022-01-21 09:42:52,7,2025-01-28 23:32:37,8,2024-10-13 14:51:57,1994-08-09 07:00:00,True,False,False,Hip-Hop/Rap
Big Poppa (2005 Remaster),The Notorious B.I.G.,The Notorious B.I.G.,"Christopher Jasper, Ernest Isley, Marvin Isley, The Notorious B.I.G., O'Kelly Isley Jr., Ronald Isley & Rudolph Bernard Isley",Ready to Die (The Remaster),Hip-Hop/Rap,8.62,4:12,13,19,1994,2022-01-21 09:42:55,14,2024-09-09 22:02:56,0,,1994-09-13 07:00:00,True,False,False,Hip-Hop/Rap
Hypnotize,The Notorious B.I.G.,The Notorious B.I.G.,"Andy Armer, Deric Angelettie, The Notorious B.I.G., Randy Alpert, Ricky Walters, Ronald Lawrence & Sean Combs",Life After Death (2014 Remaster),Hip-Hop/Rap,8.09,3:49,3,24,1997,2022-01-21 09:45:00,11,2024-11-06 21:30:16,3,2025-02-09 16:53:58,1997-03-01 08:00:00,True,False,False,Hip-Hop/Rap
Notorious Thugs,The Notorious B.I.G.,The Notorious B.I.G.,"Anthony Henderson, Bryon McCane, The Notorious B.I.G., Sean Combs, Steve Howse & Stevie J.",Life After Death (2014 Remaster),Hip-Hop/Rap,13.3,6:06,13,24,1997,2022-01-21 09:45:35,12,2025-03-29 14:12:01,1,2024-03-31 22:33:23,1997-03-25 08:00:00,True,False,False,Hip-Hop/Rap
Dead Wrong (feat. Eminem) [2005 Remaster],The Notorious B.I.G.,The Notorious B.I.G.,"Al Green, Carl Thompson, Christopher Wallace, Marshall Mathers & Osten Harvey",Born Again,Hip-Hop/Rap,10.05,4:57,3,18,1999,2022-01-21 09:47:55,8,2024-09-12 18:31:14,4,2024-02-16 23:46:50,1999-10-26 07:00:00,True,False,False,Hip-Hop/Rap
Can't You See (feat. The Notorious B.I.G.),Total,Total,"F. Wesley, J. Howell, J. Starks, M. South, T. Robinson & R. Ryan",Can't You See (25th Anniversary - Remaster),Hip-Hop/Rap,10.37,4:52,1,12,1995,2022-01-21 09:50:36,8,2025-03-15 08:51:16,2,2023-06-14 13:33:14,1995-01-01 12:00:00,True,False,False,Hip-Hop/Rap
Get Money,Junior M.A.F.I.A.,Junior M.A.F.I.A.,"B. Bedford, Christopher Wallace, Kimberly Jones, Lamont Porter, Roy Ayers & S. Striplin",Conspiracy,Hip-Hop/Rap,9.3,4:34,7,15,1995,2022-01-21 09:53:02,11,2025-03-09 22:01:28,0,,1995-08-29 07:00:00,True,False,False,Hip-Hop/Rap
N****s Bleed,The Notorious B.I.G.,The Notorious B.I.G.,"Carlos Broady, Nasheim Myrick, The Notorious B.I.G., Sean Combs & Stevie Jordan",Life After Death (2014 Remaster),Hip-Hop/Rap,10.49,4:51,11,24,1997,2022-01-21 10:02:03,8,2024-10-13 16:07:42,3,2023-10-27 18:55:34,1997-03-25 08:00:00,True,False,False,Hip-Hop/Rap
Ten Crack Commandments,The Notorious B.I.G.,The Notorious B.I.G.,"Chris Martin, Khary Turner & The Notorious B.I.G.",Life After Death (2014 Remaster),Hip-Hop/Rap,7.02,3:24,17,24,1997,2022-01-21 10:03:23,7,2025-02-01 21:19:04,2,2022-01-22 22:14:12,1997-03-25 08:00:00,True,False,False,Hip-Hop/Rap
Warning (2005 Remaster),The Notorious B.I.G.,The Notorious B.I.G.,"Burt Bacharach, Hal David, The Notorious B.I.G. & Osten Harvey",Ready to Die (The Remaster),Hip-Hop/Rap,7.57,3:40,5,19,1994,2022-01-21 10:22:58,10,2025-03-09 22:13:13,7,2025-02-08 04:09:14,1994-09-13 07:00:00,True,False,False,Hip-Hop/Rap
I Got a Story To Tell,The Notorious B.I.G.,The Notorious B.I.G.,"Anthony Best, Chucky Thompson, The Notorious B.I.G. & Sean Combs",Life After Death (2014 Remaster),Hip-Hop/Rap,9.52,4:43,12,24,1997,2022-01-21 18:38:02,10,2025-02-09 17:27:18,5,2022-11-19 23:37:50,1997-03-25 08:00:00,True,False,False,Hip-Hop/Rap
Sky's the Limit (feat. 112),The Notorious B.I.G.,The Notorious B.I.G.,"Clark Kent, Hubert Eaves III, James Williams, The Notorious B.I.G., Robert Caldwell & Sean Combs",Life After Death (2014 Remaster),Hip-Hop/Rap,11.1,5:29,20,24,1997,2022-01-22 18:08:21,16,2025-02-10 01:11:37,13,2025-01-16 01:35:36,1997-03-25 08:00:00,True,True,False,Hip-Hop/Rap
Proud,Paper Route Empire & Key Glock,Paper Route Empire,,Long Live Young Dolph,Hip-Hop/Rap,6.33,3:04,3,8,2022,2022-01-22 18:22:46,5,2025-04-26 22:15:05,5,2024-04-01 22:46:01,2022-01-18 12:00:00,True,False,True,Hip-Hop/Rap
Keep Ya Head Up,2Pac,2Pac,"D. Anderson, Troutman & 2Pac",Strictly 4 My N.I.G.G.A.Z.,Hip-Hop/Rap,9.14,4:22,11,16,1993,2022-01-22 18:42:50,6,2025-03-28 21:30:20,1,2023-12-13 21:15:27,1993-02-16 12:00:00,True,False,False,Hip-Hop/Rap
I Get Around (feat. Digital Underground),2Pac,2Pac,"R. Brooks, Troutman, Larry Troutman, Shock G, 2Pac & Shirley Murdock",Strictly 4 My N.I.G.G.A.Z.,Hip-Hop/Rap,8.69,4:19,14,16,1993,2022-01-22 18:42:52,8,2025-04-25 06:26:36,2,2024-01-09 07:16:18,1993-02-16 12:00:00,True,False,False,Hip-Hop/Rap
I Ain't Mad At Cha (feat. Danny Boy),2Pac,2Pac,"2Pac, D. Arnaud, D. Stewart & E. Jordan",All Eyez On Me,Hip-Hop/Rap,9.81,4:53,13,14,1996,2022-01-22 18:43:54,7,2024-12-31 20:57:13,1,2023-04-16 02:18:19,1996-02-13 12:00:00,True,False,False,Hip-Hop/Rap
2 Of Amerikaz Most Wanted (feat. Snoop Dogg),2Pac,2Pac,"2Pac, Calvin Broadus & D. Arnaud",All Eyez On Me,Hip-Hop/Rap,8.73,4:06,6,14,1996,2022-01-22 18:44:12,7,2025-03-04 23:36:05,1,2022-06-04 02:22:46,1996-02-13 12:00:00,True,False,False,Hip-Hop/Rap
"Picture Me Rollin' (feat. Big Syke, CPO & Danny Boy)",2Pac,2Pac,"2Pac, J. Jackson, T. Himes & V. Edwards",All Eyez On Me,Hip-Hop/Rap,11.31,5:14,7,13,1996,2022-01-22 18:44:18,9,2025-06-27 22:52:10,4,2022-11-05 16:59:51,1996-02-13 12:00:00,True,False,False,Hip-Hop/Rap
Temptations,2Pac,2Pac,"R. Noble, Garry Shider, Roger Troutman, Larry Troutman, George Clinton, Shirley Murdock, Osten Harvey Jr., David Spradley, Easy Mo Bee & 2Pac",Me Against the World,Hip-Hop/Rap,11.26,5:00,5,15,1995,2022-01-22 18:45:39,20,2024-12-18 15:51:36,15,2025-02-09 17:43:43,1995-03-14 08:00:00,True,False,False,Hip-Hop/Rap
Heathens,twenty one pilots,Various Artists,Tyler Joseph,Suicide Squad: The Album,Alternative,7.13,3:15,3,14,2016,2022-01-30 08:15:06,20,2025-01-23 21:24:11,3,2024-07-20 22:25:27,2016-06-16 12:00:00,False,False,False,Alternative
Be Honest (feat. Burna Boy),Jorja Smith,Jorja Smith,"Amira Benameur, Andron Francois Cross, Damini Ogulu, Jorja Smith & Oliver Rodigan",Be Honest (feat. Burna Boy) - Single,R&B/Soul,7.13,3:27,1,1,2019,2022-02-01 04:08:29,21,2024-12-20 19:10:13,5,2024-07-14 15:14:12,2019-08-16 12:00:00,False,False,False,R&B/Soul
bad guy,Billie Eilish,Billie Eilish,Billie Eilish & FINNEAS,"WHEN WE ALL FALL ASLEEP, WHERE DO WE GO?",Alternative,6.87,3:14,2,14,2019,2022-02-01 04:26:28,19,2025-01-22 20:23:55,6,2025-02-13 21:16:53,2019-03-29 12:00:00,False,False,False,Alternative
ocean eyes,Billie Eilish,Billie Eilish,FINNEAS,dont smile at me,Alternative,6.85,3:20,7,9,2016,2022-02-01 04:27:20,6,2025-01-13 16:23:15,1,2024-04-19 01:44:03,2016-05-18 12:00:00,False,False,False,Alternative
everything i wanted,Billie Eilish,Billie Eilish,FINNEAS & Billie Eilish,everything i wanted - Single,Alternative,8.45,4:05,1,1,2019,2022-02-01 04:29:19,13,2024-08-03 19:41:37,7,2024-03-31 21:55:38,2019-11-13 12:00:00,False,False,False,Alternative
idontwannabeyouanymore,Billie Eilish,Billie Eilish,FINNEAS & Billie Eilish,dont smile at me,Alternative,6.94,3:23,2,9,2017,2022-02-01 04:29:34,3,2024-10-13 04:16:32,4,2024-10-08 00:27:09,2017-07-20 12:00:00,False,False,False,Alternative
Rock With You,Michael Jackson,Michael Jackson,Rodney Temperton,Off the Wall,Pop,7.79,3:39,2,10,1979,2022-02-01 04:33:58,17,2025-03-19 23:33:41,5,2023-11-13 16:00:17,1979-08-10 07:00:00,False,False,False,Pop
Feel It Still,Portugal. The Man,Portugal. The Man,"Asa Taccone, Brian Holland, Frederick Gorman, John Hill, Portugal. The Man, Robert Bateman & Zoe English",Woodstock,Alternative,5.72,2:43,4,9,2017,2022-02-01 04:55:30,15,2025-01-13 16:48:33,4,2024-02-06 00:34:08,2017-03-02 08:00:00,False,False,False,Alternative
Howlin' for You,The Black Keys,The Black Keys,Dan Auerbach & Patrick Carney,Brothers (Deluxe Anniversary Edition),Alternative,7.43,3:11,4,18,2010,2022-02-01 05:05:16,11,2025-04-12 01:39:45,4,2023-05-12 19:43:23,2010-05-18 07:00:00,False,False,False,Alternative
Paradise,Coldplay,Coldplay,"Brian Eno, Chris Martin, Guy Berryman, Jonny Buckland & Will Champion",Mylo Xyloto,Alternative,9.44,4:37,3,14,2011,2022-02-01 05:38:20,18,2024-12-29 23:26:04,6,2024-10-21 11:52:37,2011-09-12 07:00:00,False,False,False,Alternative
Renegades,X Ambassadors,X Ambassadors,"Noah Feldshuh, Casey Harris, Sam Harris, A. Grant & Adam Levin",VHS 2.0,Alternative,7.03,3:15,1,18,2015,2022-02-01 05:50:20,12,2025-01-23 19:54:07,6,2025-07-06 21:26:03,2015-03-03 12:00:00,False,False,False,Alternative
Sweater Weather,The Neighbourhood,The Neighbourhood,"Jesse®, Zachary Abels & Jeremy Freedman",I Love You.,Alternative,8.19,4:00,4,11,2012,2022-02-01 06:02:00,9,2025-01-23 19:58:21,8,2024-02-28 06:52:42,2012-12-03 08:00:00,False,False,False,Alternative
The Sound,The 1975,The 1975,"Matthew Healy, George Daniel, Adam Hann & Ross MacDonald","I like it when you sleep, for you are so beautiful yet so unaware of it",Alternative,8.62,4:08,13,17,2016,2022-02-01 06:08:07,14,2025-05-12 22:40:23,2,2022-09-19 14:37:02,2016-01-14 12:00:00,False,False,False,Alternative
On the Road (feat. Meek Mill & Lil Baby),Post Malone,Post Malone,"Austin Post, Robert Williams, Dominique' Jones, Louis Bell, Nick Mira, Billy Walsh & Tavoris Hollins, Jr.",Hollywood's Bleeding,Hip-Hop/Rap,7.38,3:38,8,16,2019,2022-02-08 06:31:08,14,2024-07-23 21:31:44,5,2025-05-20 21:15:27,2019-09-06 12:00:00,True,False,False,Hip-Hop/Rap
Circles,Post Malone,Post Malone,"Louis Bell, Austin Post, Adam Feeney, Billy Walsh & Kaan Gunesberk",Hollywood's Bleeding,Hip-Hop/Rap,7.37,3:35,6,16,2019,2022-02-08 14:58:36,22,2024-12-02 00:19:46,12,2025-02-19 19:00:58,2019-08-30 07:00:00,False,False,False,Hip-Hop/Rap
Wish (feat. Trippie Redd),Diplo,Diplo,"Boaz de Jong, Michael White II, Robin P. Francesco, Thomas Wesley Pentz & Wyatt Charles Bamford Sanders",California - EP,Hip-Hop/Rap,6.09,2:55,4,6,2018,2022-02-09 02:30:04,6,2024-10-08 04:44:09,0,,2018-03-23 12:00:00,True,False,False,Hip-Hop/Rap
"Dreams, Fairytales, Fantasies (feat. Brent Faiyaz & Salaam Remi)",A$AP Ferg,A$AP Ferg,"Salaam Remi, Darold Brown, Christopher Wood & James Poyser",Floor Seats,Hip-Hop/Rap,7.59,3:42,9,9,2019,2022-02-16 07:06:58,14,2024-11-12 16:57:09,6,2025-04-12 14:26:57,2019-08-16 07:00:00,True,False,False,Hip-Hop/Rap
Lost,Frank Ocean,Frank Ocean,"Micah Otano, Frank Ocean, Paul Shelton & James Ho",channel ORANGE,Pop,7.97,3:54,11,17,2012,2022-02-16 18:12:08,14,2025-03-19 17:33:48,11,2025-03-30 18:28:08,2012-07-10 07:00:00,True,False,False,Pop
Self Control,Frank Ocean,Frank Ocean,,Blonde,Pop,8.51,4:09,7,17,2016,2022-02-16 18:18:06,25,2024-09-14 17:31:07,15,2025-03-29 15:24:39,2016-08-20 07:00:00,False,False,False,Pop
Am I Wrong (feat. ScHoolboy Q),Anderson .Paak,Anderson .Paak,Ivan Jackson Rosenberg,Malibu,R&B/Soul,9.08,4:13,6,16,2015,2022-02-16 18:19:41,15,2025-04-16 20:23:36,3,2024-08-23 20:37:03,2015-11-09 08:00:00,True,False,True,R&B/Soul
Hurricane,Kanye West,Kanye West,"Kanye West, Abel Tesfaye, Dominique' Jones, Jahmal Gwin, Khalil Abdul-Rahman, Ronald Spence Jr., MIKE DEAN, Raul Cubina, Mark Williams, Mark Mbogo, Daniel Seeff, Sam Barsh, Josh Mease, Christopher Ruelas, Henry Walter, Charles Njapa, Malik Yusef, Albert D",Donda (Deluxe),Hip-Hop/Rap,8.09,4:03,2,32,2021,2022-02-16 18:27:08,7,2025-04-16 20:58:03,3,2024-09-22 22:06:54,2021-08-29 07:00:00,False,False,False,Hip-Hop/Rap
Moon,Kanye West,Kanye West,"Kanye West, Caleb Toliver, Scott Mescudi, Jahmal Gwin, Khalil Abdul-Rahman, Evan Mast & Malik Yusef",Donda (Deluxe),Hip-Hop/Rap,5.46,2:36,3,32,2021,2022-02-16 18:31:42,38,2024-08-03 19:17:27,14,2025-05-20 22:14:30,2021-08-29 07:00:00,False,False,False,Hip-Hop/Rap
Life Of The Party,Kanye West & André 3000,Kanye West,"Kanye West, Raul Cubina, Mark Williams, Brian Miller, Jahmal Gwin, Anthony C. Khan, Federico Vindver, Dwayne Abernathy Jr, André Benjamin, Derek Watkins, Malik Yusef, Terrence Thornton, Rennard East, Norma Jean Toney, Paul Anastasio, Jack Hansen & Bruce K",Donda (Deluxe),Hip-Hop/Rap,12.89,6:31,4,32,2021,2022-02-16 18:34:23,30,2025-02-01 21:39:04,8,2025-02-01 21:32:24,2021-11-14 08:00:00,False,False,False,Hip-Hop/Rap
Look What You've Done,Drake,Drake,"Aubrey Drake Graham, Noah ""40"" Shebib & J. Woodward",Take Care (Deluxe Version),Hip-Hop/Rap,9.94,5:01,15,20,2011,2022-02-16 18:53:42,15,2025-03-29 15:29:42,3,2023-04-29 07:09:23,2011-11-15 08:00:00,True,False,False,Hip-Hop/Rap
Blow My High (Members Only),Kendrick Lamar,Kendrick Lamar,,Section.80,Hip-Hop/Rap,7.33,3:35,13,15,2011,2022-02-16 19:10:09,37,2025-02-03 20:25:40,10,2024-04-30 22:26:18,2011-07-02 07:00:00,True,False,True,Hip-Hop/Rap
No Make-Up (Her Vice) [feat. Colin Munroe],Kendrick Lamar,Kendrick Lamar,,Section.80,Hip-Hop/Rap,7.98,3:55,4,15,2011,2022-02-16 19:14:55,10,2025-02-11 20:54:48,8,2025-01-18 23:38:34,2011-07-02 07:00:00,True,False,True,Hip-Hop/Rap
Black Boy Fly (Bonus Track),Kendrick Lamar,Kendrick Lamar,"Kendrick Lamar, C. Smith & D. Parker","good kid, m.A.A.d city (Deluxe Version)",Hip-Hop/Rap,9.33,4:38,14,18,2012,2022-02-16 19:23:10,7,2024-05-10 01:53:07,1,2022-02-17 06:57:28,2012-10-22 07:00:00,True,False,False,Hip-Hop/Rap
Jail,Kanye West,Kanye West,"Kanye West, Shawn Carter, Raul Cubina, Charles Njapa, Mark Williams, Dwayne Abernathy Jr, Michael Dean, Sean Solymar, Warryn Campbell, John Peter Moylett & Malik Yusef",Donda (Deluxe),Hip-Hop/Rap,10.19,4:57,6,32,2021,2022-02-16 19:29:53,9,2025-03-15 21:26:09,2,2024-06-25 23:11:39,2021-08-29 07:00:00,False,False,False,Hip-Hop/Rap
4 Willem,Caleborate,Caleborate,Caleb Parker & Willem Ardui,Real Person,Hip-Hop/Rap,11.44,5:39,4,10,2017,2022-02-27 21:20:43,18,2024-06-08 22:52:28,8,2025-06-21 04:22:57,2017-10-06 12:00:00,True,False,False,Hip-Hop/Rap
Caught Up,Caleborate,Caleborate,Willem Ardui & Caleb Parker,Real Person,Hip-Hop/Rap,7.25,3:34,1,10,2017,2022-02-27 21:29:54,15,2025-01-06 17:48:05,2,2025-03-30 18:30:50,2017-10-06 12:00:00,True,False,False,Hip-Hop/Rap
Soul,Caleborate,Caleborate,Caleb Parker,Real Person,Hip-Hop/Rap,8.92,4:30,2,10,2017,2022-02-27 21:50:03,17,2025-03-28 21:34:50,6,2023-08-20 13:33:26,2017-10-06 12:00:00,True,False,False,Hip-Hop/Rap
Survival of the Fittest,Mobb Deep,Mobb Deep,Albert Johnson & Kejuan Muchita,The Infamous (25th Anniversary Expanded Edition),Hip-Hop/Rap,7.62,3:44,3,21,1995,2022-03-05 20:01:49,12,2025-04-22 23:33:29,3,2024-04-26 20:22:59,1995-04-25 07:00:00,True,False,False,Hip-Hop/Rap
Give Up the Goods (Just Step) [feat. Big Noyd],Mobb Deep,Mobb Deep,"Tajuan Perry, Kamaal Fareed, Albert Johnson, Kejuan Muchita & Mayfield W. Small, Jr.",The Infamous (25th Anniversary Expanded Edition),Hip-Hop/Rap,8.25,4:03,6,21,1995,2022-03-05 20:01:56,39,2025-04-22 23:50:09,13,2024-06-19 14:48:02,1995-04-25 07:00:00,True,True,False,Hip-Hop/Rap
"Shook Ones, Pt. II",Mobb Deep,Mobb Deep,Kejuan Muchita & Albert Johnson,The Infamous (25th Anniversary Expanded Edition),Hip-Hop/Rap,10.84,5:25,15,21,1995,2022-03-05 20:02:14,9,2025-04-23 02:30:50,2,2023-09-06 15:37:09,1995-04-25 07:00:00,True,False,False,Hip-Hop/Rap
