Midnight City,M83,M83,"Anthony Gonzalez, Justin Meldal Johnsen, M83, Morgan Kibby & Morgan  Kibby, JUSTIN  Meldal-JOHNSEN, ANTHONY  GONZALES","Hurry Up, We're Dreaming",Electronic,8.09,4:01,2,11,2011,2023-11-23 20:31:37,6,2025-06-16 20:03:29,0,,2011-07-19 07:00:00,False,False,False,EDM/Amapiano
stranger,Jhené Aiko,Jhené Aiko,"Jhené Aiko, BRIAN KEITH WARFIELD & Maclean Robinson",Sailing Soul(s) [2021 Bonus Tracks Edition],R&B/Soul,7.34,3:34,2,16,2011,2023-11-25 08:54:53,8,2025-03-31 21:31:10,0,,2011-03-16 07:00:00,True,False,False,R&B/Soul
Triggered (freestyle),Jhené Aiko,Jhené Aiko,"Jhené Aiko, BRIAN KEITH WARFIELD, Maclean Robinson, Julian-Quan Viet Le & Ross James O'Donoghue",Triggered (freestyle) - Single,R&B/Soul,7.13,3:31,1,1,2019,2023-11-25 08:55:03,6,2024-12-08 11:52:36,0,,2019-05-08 12:00:00,True,False,False,R&B/Soul
42,Boj & Ajebutter 22,Boj & Ajebutter 22,"Mobolaji Odojukan, Akitoye Balogun, Spax & Akano Samuel Wisdom",Make E No Cause Fight 3 - EP,Worldwide,5.88,2:51,1,5,2023,2023-11-25 09:06:14,21,2024-11-27 03:24:49,5,2024-10-31 23:25:42,2023-11-17 12:00:00,True,False,False,Afrobeats
Ride (feat. Young Thug),Mariah the Scientist,Mariah the Scientist,"Mariah Buckles, Jeffrey Williams, Arin Fields, Yuval Chain & Corey Moon",To Be Eaten Alive,R&B/Soul,6.29,3:00,10,10,2023,2023-11-26 18:33:20,15,2025-01-19 01:51:30,1,2024-01-20 02:31:58,2023-10-27 12:00:00,False,False,False,R&B/Soul
Propeller (feat. Dave & BNXN fka Buju),JAE5,JAE5,"JAE5, David Omoregie & Daniel Benson",Propeller (feat. Dave & BNXN fka Buju) - Single,Hip-Hop/Rap,7.03,3:24,1,1,2022,2023-11-27 22:34:58,12,2025-04-04 17:25:04,1,2024-11-09 13:56:25,2022-07-22 12:00:00,True,False,False,Hip-Hop/Rap
Emergency,Boj & Ajebutter 22,Boj & Ajebutter 22,"Mobolaji Odojukan, Akitoye Balogun, Spax & Akano Samuel Wisdom",Make E No Cause Fight 3 - EP,Worldwide,8.38,4:06,2,5,2023,2023-11-28 13:07:07,5,2025-01-04 07:01:55,1,2023-11-30 17:52:30,2023-11-17 12:00:00,True,False,False,Afrobeats
Rora,Boj & Ajebutter 22,Boj & Ajebutter 22,"Mobolaji Odojukan, Akitoye Balogun, Spax & Akano Samuel Wisdom",Make E No Cause Fight 3 - EP,Worldwide,5.09,2:23,3,5,2023,2023-11-28 13:19:19,12,2024-11-20 00:37:27,4,2025-03-24 14:55:58,2023-10-12 12:00:00,False,False,False,Afrobeats
Sweet Life,"Boj, Ajebutter 22 & Show Dem Camp",Boj & Ajebutter 22,"Mobolaji Odojukan, Akitoye Balogun, Wale Davies, Olumide Ayeni & Spax",Make E No Cause Fight 3 - EP,Worldwide,6.43,3:06,4,5,2023,2023-11-28 13:31:37,9,2025-04-12 16:48:25,0,,2023-11-17 12:00:00,True,False,False,Afrobeats
DITR,Boj & Ajebutter 22,Boj & Ajebutter 22,"Mobolaji Odojukan, Akitoye Balogun, Spax & Akano Samuel Wisdom",Make E No Cause Fight 3 - EP,Worldwide,5.81,2:46,5,5,2023,2023-11-28 13:36:17,3,2024-12-29 01:42:45,4,2023-12-28 06:06:21,2023-11-17 12:00:00,True,False,False,Afrobeats
Good Times,Mariah the Scientist,Mariah the Scientist,"Mariah Buckles, Evann Lacour & Anthony Jefferies",To Be Eaten Alive,R&B/Soul,6.17,2:57,2,10,2023,2023-12-01 01:26:56,20,2025-07-18 09:48:01,1,2025-03-18 21:32:48,2023-10-27 12:00:00,False,False,False,R&B/Soul
40 Days n 40 Nights (feat. Vory),Mariah the Scientist,Mariah the Scientist,"Mariah Buckles, Tavoris Hollins, Jr., Khalid Imam, Anthony Jefferies & Tanner Ott",To Be Eaten Alive,R&B/Soul,6.75,3:16,4,10,2023,2023-12-01 01:35:12,12,2024-06-23 02:01:01,2,2024-02-20 02:22:19,2023-10-27 12:00:00,True,False,False,R&B/Soul
'02 Lakers (feat. Ro$ama),BigXthaPlug,BigXthaPlug,,THE BIGGEST,Hip-Hop/Rap,5.7,2:43,4,7,2023,2023-12-05 01:05:30,13,2025-04-11 20:46:47,2,2023-12-08 02:09:55,2023-11-17 08:00:00,True,False,False,Hip-Hop/Rap
Mmhmm,BigXthaPlug,BigXthaPlug,,THE BIGGEST,Hip-Hop/Rap,4.26,1:59,3,7,2023,2023-12-05 01:07:43,9,2025-02-09 01:39:08,0,,2023-10-06 07:00:00,True,False,False,Hip-Hop/Rap
Climate,BigXthaPlug & Offset,BigXthaPlug,,THE BIGGEST,Hip-Hop/Rap,5.98,2:50,2,7,2023,2023-12-06 00:25:52,11,2025-03-03 19:29:30,1,2024-07-16 21:37:54,2023-12-01 12:00:00,True,False,False,Hip-Hop/Rap
Rock & Roll,BigXthaPlug,BigXthaPlug,,THE BIGGEST,Hip-Hop/Rap,4.56,2:09,5,7,2023,2023-12-06 00:29:30,14,2025-02-09 01:01:00,2,2024-07-16 22:46:08,2023-12-01 12:00:00,True,False,False,Hip-Hop/Rap
Patience,BigXthaPlug,BigXthaPlug,,THE BIGGEST,Hip-Hop/Rap,3.47,1:34,6,7,2023,2023-12-06 00:31:53,5,2025-04-26 22:26:50,0,,2023-12-01 12:00:00,True,False,False,Hip-Hop/Rap
Ron Artest,Babyface Ray & 42 Dugg,Babyface Ray & 42 Dugg,,Ron Artest - Single,Hip-Hop/Rap,5.24,2:33,1,1,2022,2023-12-06 12:30:34,23,2025-01-10 22:49:42,2,2024-06-19 14:47:35,2022-12-31 12:00:00,True,True,True,Hip-Hop/Rap
Family > Money,Babyface Ray,Babyface Ray,Marcellus Register & Darryl Clemons,FACE (Deluxe Edition),Hip-Hop/Rap,7.98,3:55,7,28,2022,2023-12-07 20:56:30,6,2025-01-11 19:45:55,1,2024-01-05 17:46:05,2022-05-20 07:00:00,True,False,True,Hip-Hop/Rap
#1 Fan,Babyface Ray,Babyface Ray,,For You - EP,Hip-Hop/Rap,6.62,3:14,3,4,2020,2023-12-07 20:58:06,21,2025-04-25 15:37:19,3,2024-07-07 04:41:03,2020-04-17 12:00:00,True,True,True,Hip-Hop/Rap
Real N****s Don't Rap,Babyface Ray,Babyface Ray,,Unfuckwitable (Deluxe Edition),Hip-Hop/Rap,6.16,2:53,8,14,2021,2023-12-07 21:00:46,12,2024-12-06 17:47:21,4,2024-10-23 22:56:34,2021-02-12 12:00:00,True,False,True,Hip-Hop/Rap
Paperwork Party,Babyface Ray,Babyface Ray,,For You - EP,Hip-Hop/Rap,6.06,2:56,4,4,2020,2023-12-07 21:03:08,7,2025-04-29 21:46:36,1,2023-12-07 21:03:40,2020-04-17 12:00:00,True,False,True,Hip-Hop/Rap
Fake Luv,Babyface Ray,Babyface Ray,,For You - EP,Hip-Hop/Rap,4.67,2:11,1,4,2020,2023-12-07 21:06:48,11,2025-01-31 20:03:37,1,2024-01-05 15:56:18,2020-04-17 12:00:00,True,False,True,Hip-Hop/Rap
Rent Free,6LACK,6LACK,"Adeyinka Bankole, Elias Knight, Eyobed Getachew, Kim ""Kaydence"" Krysiuk, Leon Thomas, Neil Aaron Huntley, Rex Masamune Kudo & Ricardo Valdez Valentine Jr.",Since I Have A Lover,R&B/Soul,7.2,3:22,16,19,2021,2023-12-08 16:06:16,4,2024-10-19 22:06:32,1,2023-12-09 23:43:39,2021-12-17 12:00:00,True,False,False,R&B/Soul
All I Need (feat. Xavier Omär),Noname,Noname,Noname & Xavier Omär,Telefone,Hip-Hop/Rap,8.05,4:00,4,10,2016,2023-12-08 16:09:08,9,2025-03-29 14:35:18,2,2025-03-30 18:28:05,2016-07-31 12:00:00,False,False,False,Hip-Hop/Rap
Glass Flows (feat. Ravyn Lenae),Smino,Smino,"Ravyn Lenae, Christopher Smith Jr. & Ahmanti Booker",blkswn,Hip-Hop/Rap,6.53,3:08,3,18,2017,2023-12-08 17:14:23,7,2024-12-15 16:10:17,1,2024-08-23 19:34:42,2017-03-14 12:00:00,True,False,False,Hip-Hop/Rap
Hustler Musik,Lil Wayne,Lil Wayne,D. Carter & T-Mix,Tha Carter II,Hip-Hop/Rap,10.25,5:03,14,22,2005,2023-12-09 11:10:51,13,2025-04-26 20:15:51,2,2024-03-23 14:20:56,2005-12-06 12:00:00,True,False,False,Hip-Hop/Rap
Chicago Boy,Ari Lennox,Ari Lennox,"Courtney Salter, Anthony Parrino, Ron Gilmore & Chico Hamilton",Shea Butter Baby,R&B/Soul,9.76,4:48,1,12,2019,2023-12-10 13:05:48,7,2025-04-12 05:32:55,1,2024-09-20 21:05:17,2019-05-07 12:00:00,True,False,False,R&B/Soul
The Sun (feat. Bryson Tiller & Raphael Saadiq),KYLE,KYLE,"Bryson Tiller, Joshua Portillo, Kyle Harvey & Raphael Saadiq",See You When I am Famous!!!!!!!!!!!!,Hip-Hop/Rap,5.42,2:36,8,12,2020,2023-12-10 13:17:45,9,2025-03-29 14:52:38,0,,2020-07-17 12:00:00,False,False,False,Hip-Hop/Rap
FLOAT (feat. Mamii),WESTSIDE BOOGIE,WESTSIDE BOOGIE,"Anthony Dixson, Darius Dixson, Keyel Walker, D. ELLIS & Amare Symoné",MORE BLACK SUPERHEROES (LIMITED EDITION),Hip-Hop/Rap,5.11,2:26,13,18,2022,2023-12-10 13:19:31,7,2025-01-24 20:49:11,1,2024-08-23 19:29:35,2022-11-18 12:00:00,True,False,False,Hip-Hop/Rap
Outside (feat. Blaqbonez),Fireboy DML,Fireboy DML,Adedamola Adefolahan & Emeka Akumefule,Outside / obaa sima - Single,African,6.27,3:00,1,2,2023,2023-12-10 13:30:59,4,2025-06-27 17:19:34,2,2025-06-27 15:57:02,2023-09-21 12:00:00,True,False,True,Afrobeats
Vibin' Out,FKJ & ((( O ))),FKJ,"Vincent Fenton, ((( O ))) & June Mariezzy",French Kiwi Juice,Electronic,10.42,5:11,5,12,2017,2023-12-10 13:43:36,5,2024-05-30 13:14:37,4,2025-01-26 00:46:45,2017-03-03 12:00:00,False,False,False,EDM/Amapiano
Changes,Elaine,Elaine,Elyzée Ilunga Mubikay,Elements,R&B/Soul,7.05,3:26,5,7,2019,2023-12-10 14:01:45,2,2024-12-29 08:15:44,1,2025-04-02 15:31:52,2019-09-29 12:00:00,True,False,False,R&B/Soul
Self Esteem - #1 Hit (Kisses for Me),Lambo4oe,Lambo4oe,john danyeal miller,Self Esteem - #1 Hit (Kisses for Me) - Single,Hip-Hop/Rap,4.62,2:08,1,1,2021,2023-12-12 02:08:19,8,2024-09-09 21:51:43,5,2024-09-24 14:42:21,2021-10-05 12:00:00,True,False,False,Hip-Hop/Rap
SHAQ & KOBE,Rick Ross & Meek Mill,Rick Ross & Meek Mill,"David Meloni Jr., Jeffery Robinson Jr., Robert Rihmeek Williams & William Leonard Roberts II",Too Good To Be True,Hip-Hop/Rap,7.32,3:39,1,16,2023,2023-12-12 03:14:59,5,2025-03-29 22:35:41,2,2024-04-13 23:41:37,2023-10-20 07:00:00,True,False,True,Hip-Hop/Rap
Unbelievable (2005 Remaster),The Notorious B.I.G.,The Notorious B.I.G.,"Chris Martin, The Notorious B.I.G. & R. Kelly",Ready to Die (The Remaster),Hip-Hop/Rap,8.04,3:43,16,19,1994,2023-12-24 09:40:36,8,2025-02-09 17:22:35,3,2024-11-06 21:39:45,1994-09-13 07:00:00,True,False,False,Hip-Hop/Rap
Get Your Shine On,Florida Georgia Line,Florida Georgia Line,"Tyler Hubbard, Brian Kelley, Joey Moi & Chase and Jesse Rice",Here's to the Good Times,Country,8.66,3:42,3,11,2012,2023-12-24 10:09:39,3,2025-04-04 01:45:34,1,2025-02-26 18:51:00,2012-05-15 12:00:00,False,False,False,Country
Wit' Da Team,Genesis Owusu,Genesis Owusu,"Kofi Owusu-Ansah, Matthew Louis Merisola, Kelsey Miguel Gonzalez & Michael Byun",Wit' Da Team - Single,Rap,7.36,3:19,1,1,2018,2023-12-27 23:34:27,6,2025-05-07 01:33:33,0,,2018-11-12 12:00:00,True,False,False,Hip-Hop/Rap
TexUS (Intro),"That Mexican OT, BigXthaPlug, D Flowers & OTB Fastlane",Various Artists,"That Mexican OT, BigXthaPlug, D Flowers & OTB Fastlane",Be Someone: Texas Population,Hip-Hop/Rap,5.75,2:45,1,28,2023,2023-12-31 21:57:58,6,2024-11-05 20:32:37,1,2024-11-05 20:32:42,2023-10-18 12:00:00,True,False,True,Hip-Hop/Rap
Casio,Jungle,Jungle,"Dean Josiah Cover, Thomas McFarland & J Lloyd",For Ever,Electronic,7.91,3:54,6,13,2018,2024-01-02 08:47:14,4,2025-03-10 13:53:55,1,2024-04-30 05:22:31,2018-09-14 12:00:00,False,False,False,EDM/Amapiano
Back On 74,Jungle,Jungle,"Josh Lloyd Watson, Thomas McFarland & Lydia Kitto",Volcano,Dance,7.18,3:29,6,14,2023,2024-01-02 08:56:47,5,2025-03-15 18:22:04,2,2024-12-11 02:07:50,2023-07-27 12:00:00,False,False,False,EDM/Amapiano
Change My Wayz,Luh Tyler,Luh Tyler,"Alijah Taylor, miles goldman & Tyler Meeks",Change My Wayz - Single,Hip-Hop/Rap,4.26,1:55,1,1,2022,2024-01-02 19:00:53,13,2025-02-13 23:34:31,5,2024-01-19 17:21:07,2022-02-23 12:00:00,True,False,False,Hip-Hop/Rap
ANGEL,Brent Faiyaz,Brent Faiyaz,"Christopher Brent Wood, Raphael Saadiq & Jordan Ware",WASTELAND,R&B/Soul,7.38,3:39,19,19,2022,2024-01-03 16:11:43,19,2025-01-24 20:08:01,5,2024-08-23 21:07:35,2022-07-08 12:00:00,True,True,False,R&B/Soul
Tryna Smoke (feat. Micahfonecheck),Jhené Aiko,Jhené Aiko,"Jhené Aiko, Micah Powell & Greg Edwards",Chilombo (Deluxe Edition),R&B/Soul,9.11,4:29,11,29,2020,2024-01-03 16:23:43,13,2025-05-03 16:16:31,3,2024-12-06 17:05:43,2020-03-06 08:00:00,True,False,False,R&B/Soul
Summers Over Interlude,Drake,Drake,Maneesh Bidaye & M. Al-Maskati,Views,Hip-Hop/Rap,3.81,1:46,17,20,2016,2024-01-03 16:24:52,14,2025-06-04 15:13:01,2,2024-07-27 13:33:46,2016-04-29 12:00:00,True,False,False,Hip-Hop/Rap
Love Is All We Need (feat. Nas),Mary J. Blige,Mary J. Blige,"Mary J. Blige, James Harris, Rick James & Terry Lewis",Share My World,R&B/Soul,8.67,4:14,3,17,1997,2024-01-03 16:27:35,4,2024-12-07 17:14:50,1,2024-06-13 23:13:03,1997-03-18 12:00:00,False,False,False,R&B/Soul
Jungle,Drake,Drake,"K. Samir, Noah ""40"" Shebib, Aubrey Drake Graham, Carlo Montagnese, M. Maskati, J. Ullman, Paul Jefferies, Ilsey Juber & Gabriel Garzón-Montano",If You're Reading This It's Too Late,Hip-Hop/Rap,10.61,5:20,16,17,2015,2024-01-03 17:11:11,5,2025-04-12 14:17:04,4,2024-12-15 16:50:45,2015-02-13 12:00:00,True,False,False,Hip-Hop/Rap
Body Language (feat. Ty Dolla $ign & Jhené Aiko),Big Sean,Big Sean,"Sean Anderson, Dwane Weir II, Justin Miles Johnson, Tyrone Griffin, Jhené Aiko & Shawn Demean Harris",Detroit 2 (Deluxe Video Version),Hip-Hop/Rap,8.12,3:44,5,21,2020,2024-01-04 00:43:27,5,2025-03-31 21:35:47,2,2024-01-04 00:56:27,2020-09-04 07:00:00,True,False,False,Hip-Hop/Rap
White Tee,Summer Walker & NO1-NOAH,Summer Walker,"Summer Walker, Jimmy Feliz Valdez, Josiah Capers & Jordan Hutchins",Life On Earth - EP,R&B/Soul,7.17,3:31,4,5,2020,2024-01-04 01:12:00,3,2024-08-21 01:07:26,0,,2020-07-10 12:00:00,True,False,False,R&B/Soul
Can't Be Stopped,Boj,Boj,Mobolaji Odojukan,Gbagada Express (Deluxe),Afrobeats,5.89,2:48,1,10,2023,2024-01-04 16:39:14,3,2025-06-28 00:08:54,0,,2023-07-14 12:00:00,False,False,False,Afrobeats
Shea Butter Baby,Ari Lennox & J. Cole,Ari Lennox,"J. Cole, Courtney Salter, Anthony Parrino & T. Schoegje",Shea Butter Baby,R&B/Soul,7.28,3:31,5,12,2018,2024-01-04 16:40:28,3,2025-06-28 00:16:41,0,,2018-11-16 08:00:00,True,False,False,R&B/Soul
Up Late,Ari Lennox,Ari Lennox,"Courtney Salter, Kojo Asamoah, Justin Bryant, Oliver Bergqvist & Nicholas Venezia",Shea Butter Baby,R&B/Soul,9.1,4:26,4,12,2019,2024-01-04 16:43:07,8,2025-02-10 15:53:57,1,2024-08-23 19:23:02,2019-04-29 07:00:00,True,False,False,R&B/Soul
Hold On,The Internet,The Internet,"Sydney Bennett, Steve Lacy, Matthew Martin, Christopher Smith, Nicholas Bennett, Amber Navran, Andris Mattson & Maximilian Bryk",Hive Mind,R&B/Soul,13.15,6:46,13,13,2018,2024-01-04 17:22:49,7,2025-04-02 15:40:37,1,2024-04-16 01:50:23,2018-07-18 12:00:00,False,False,False,R&B/Soul
Peso,A$AP Rocky,A$AP Rocky,"Rakim Mayers, Tyshaun Holloway, Terry Lewis & James Harris",LIVE.LOVE.A$AP,Hip-Hop/Rap,5.83,2:49,2,15,2011,2024-01-05 07:40:34,5,2025-02-26 04:02:18,0,,2011-10-31 07:00:00,True,False,False,Hip-Hop/Rap
Wassup,A$AP Rocky,A$AP Rocky,"Rakim Mayers, Michael Volpe & Mimi Goese",LIVE.LOVE.A$AP,Hip-Hop/Rap,5.66,2:38,4,15,2011,2024-01-05 07:40:38,12,2025-02-26 04:04:54,2,2025-03-30 02:03:19,2011-10-31 07:00:00,True,False,False,Hip-Hop/Rap
Fashion Killa,A$AP Rocky,A$AP Rocky,"Rakim Mayers, Hector Delgado, James Laurence, Dylan Reznick, Christopher ""Tricky"" Stewart & Terius ""The-Dream"" Nash",LONG.LIVE.A$AP (Deluxe Edition),Hip-Hop/Rap,8.66,3:56,10,17,2013,2024-01-05 15:04:19,9,2025-04-12 16:56:50,0,,2013-01-15 12:00:00,True,False,False,Hip-Hop/Rap
Gin and Juice,Snoop Dogg,Snoop Dogg,Calvin Cordozar Broadus Jr.,Doggystyle,Hip-Hop/Rap,7.29,3:31,3,13,1993,2024-01-11 02:06:25,3,2025-05-04 14:28:24,2,2024-09-08 00:06:42,1993-11-23 12:00:00,True,False,True,Hip-Hop/Rap
sneaky,21 Savage,21 Savage,Shéyaa Bin Abraham-Joseph & Edward Maclin Cooper III,american dream,Hip-Hop/Rap,6.94,3:21,5,15,2024,2024-01-12 09:12:47,4,2025-02-12 19:58:57,0,,2024-01-12 12:00:00,True,False,False,Hip-Hop/Rap
Bullseye 2,Real Boston Richey & Future,Real Boston Richey,Real Boston Richey,Public Housing,Hip-Hop/Rap,5.32,2:37,12,17,2022,2024-01-12 09:21:36,9,2024-11-08 17:48:56,0,,2022-08-26 12:00:00,True,False,True,Hip-Hop/Rap
née-nah,"21 Savage, Travis Scott & Metro Boomin",21 Savage,"Shéyaa Bin Abraham-Joseph, Jacques Webster II, Leland Tyler Wayne, Douglas Ford, Malcolm McLaren, William Handy & Rodney Argent",american dream,Hip-Hop/Rap,7.57,3:40,9,15,2024,2024-01-12 09:26:31,18,2025-04-12 21:09:12,1,2024-01-31 04:48:23,2024-01-10 12:00:00,True,False,False,Hip-Hop/Rap
see the real,21 Savage,21 Savage,"Shéyaa Bin Abraham-Joseph, Jason Cornet, Dylan Cleary-Krell, Joshua Parker, Jocelyn Donald, Jordan Holt-May & Samuel David Jimenez",american dream,Hip-Hop/Rap,6.31,3:02,10,15,2024,2024-01-12 09:30:31,5,2025-05-20 23:22:48,1,2024-01-31 04:48:27,2024-01-12 12:00:00,True,False,False,Hip-Hop/Rap
prove it,21 Savage & Summer Walker,21 Savage,"Summer Walker, Shéyaa Bin Abraham-Joseph, Tye Beats, Edward Maclin Cooper III, Isaiah Brown, Tauren kngs Stovall, Keith Thomas, James Owens, Faith Evans & Carl Thompson",american dream,Hip-Hop/Rap,7.18,3:27,11,15,2024,2024-01-12 09:33:46,5,2025-04-12 17:02:43,0,,2024-01-10 12:00:00,True,False,False,Hip-Hop/Rap
all of me,21 Savage,21 Savage,"Shéyaa Bin Abraham-Joseph, Yakki, Sterling White Jr., Jalen Jackson, Khaya Gilika, Jared Brown, Isaiah Brown, Raphael Oliveira & Billie Rae Calvin",american dream,Hip-Hop/Rap,6.79,3:18,2,15,2024,2024-01-12 09:37:07,5,2025-05-20 21:15:18,0,,2024-01-12 12:00:00,True,False,False,Hip-Hop/Rap
should've wore a bonnet,21 Savage & Brent Faiyaz,21 Savage,"Shéyaa Bin Abraham-Joseph, Christopher Wood, Ronald Nathan Latour Jr., John Julian, David Patino, Francis Esteban, Darryl Pearson, Donald Earle De Grate Jr, Joel Hailey & Daveon Jackson",american dream,Hip-Hop/Rap,6.44,3:06,12,15,2024,2024-01-12 09:43:04,4,2025-04-29 21:49:41,0,,2024-01-10 12:00:00,True,False,False,Hip-Hop/Rap
red sky,"21 Savage, Tommy Newport & Mikky Ekko",21 Savage,"Tommy Newport, Shéyaa Bin Abraham-Joseph, Carlton Mays Jr., 4th Pyramid, Courtney Dwight, John Stephen Sudduth & Shaan Ramaprasad",american dream,Hip-Hop/Rap,6.14,2:56,14,15,2024,2024-01-12 09:46:16,8,2025-01-13 03:37:20,1,2025-04-26 22:56:33,2024-01-12 12:00:00,True,False,False,Hip-Hop/Rap
Only Me,Asake,Asake,Ahmed Ololade,Only Me - Single,African,5.73,2:39,1,1,2024,2024-01-14 09:53:51,5,2025-03-04 23:51:26,0,,2024-01-12 12:00:00,False,False,True,Afrobeats
Duffel Bag,Joeboy,Joeboy,"Wade Oghenejabor, Emmanuel Kelechi Ikechukwu, Samuel Adetiloye, Momoh Oshiotseameh Luke & Joseph Akinwale Akinfenwa-Donus",Body & Soul,Afrobeats,4.59,2:07,5,15,2023,2024-01-14 09:58:18,5,2025-06-27 15:56:45,2,2025-05-18 03:31:37,2023-04-07 07:00:00,False,False,True,Afrobeats
The Resistance,Drake,Drake,"Aubrey Drake Graham, Noah ""40"" Shebib, Matthew Jehu Samuels & O. El-Khatib",Thank Me Later,Hip-Hop/Rap,7.63,3:45,3,14,2010,2024-01-15 05:59:03,13,2024-12-06 18:19:38,7,2025-02-16 02:04:46,2010-06-15 07:00:00,True,False,False,Hip-Hop/Rap
Show Me a Good Time,Drake,Drake,"Aubrey Drake Graham, K. West, J. Bhasker & E. Wilson",Thank Me Later,Hip-Hop/Rap,7.16,3:30,5,14,2010,2024-01-20 02:11:11,5,2024-09-06 20:05:29,1,2024-01-22 19:52:28,2010-06-15 07:00:00,True,False,False,Hip-Hop/Rap
Unforgettable (feat. Young Jeezy),Drake,Drake,"Aubrey Drake Graham, Noah ""40"" Shebib, Matthew Jehu Samuels, J. Jenkins, R. Isley, M. Isley, O. Isley, C. Jasper & E. Isley",Thank Me Later,Hip-Hop/Rap,7.2,3:33,9,14,2010,2024-01-20 02:13:49,2,2025-02-10 02:02:48,0,,2010-06-15 07:00:00,True,False,False,Hip-Hop/Rap
Thank Me Now,Drake,Drake,Aubrey Drake Graham & T. Mosely,Thank Me Later,Hip-Hop/Rap,10.79,5:28,14,14,2010,2024-01-20 02:16:58,4,2025-05-18 03:22:40,2,2024-07-20 22:22:29,2010-06-15 07:00:00,True,False,False,Hip-Hop/Rap
Sweet You,Phonte,Phonte,Phonte,No News Is Good News,Hip-Hop/Rap,9.27,4:27,8,10,2018,2024-01-28 18:15:06,15,2025-03-28 14:13:19,2,2024-10-31 20:51:02,2018-03-02 12:00:00,True,False,True,Hip-Hop/Rap
the BLACK seminole.,Lil Yachty,Lil Yachty,"Jacob Portrait, Jeremiah Raisen, Justin Raisen, Miles Parks McCollum, Patrick Wimberly, Joe Kennedy & Anthony Paul Lopez",Let’s Start Here.,Alternative,13.92,6:51,1,14,2023,2024-02-02 01:58:37,5,2025-02-26 03:52:49,2,2025-03-05 12:59:38,2023-01-27 12:00:00,False,False,False,Alternative
the ride-,Lil Yachty,Lil Yachty,"Aaron Thomas, Jack Latham, Jeremiah Raisen, Justin Raisen, Miles Parks McCollum, Miles Robinson & Patrick Wimberly",Let’s Start Here.,Alternative,6.65,3:10,2,14,2023,2024-02-02 02:03:32,4,2024-12-01 08:30:30,4,2025-03-05 12:59:41,2023-01-27 12:00:00,False,False,False,Alternative
running out of time,Lil Yachty,Lil Yachty,"Jeremiah Raisen, Justin Raisen, Matthew Lewin, Mica Tenenbaum, Miles Parks McCollum, Patrick Wimberly, aris tatalovich & Justine Skye",Let’s Start Here.,Alternative,9.84,4:29,3,14,2023,2024-02-02 02:07:27,9,2025-02-26 04:10:04,0,,2023-01-27 12:00:00,False,False,False,Alternative
THE zone~,Lil Yachty,Lil Yachty,"Jacob Portrait, Jeremiah Raisen, Miles Parks McCollum, Patrick Wimberly, Khaya Cohen & Justine Skye",Let’s Start Here.,Alternative,8.48,4:09,6,14,2023,2024-02-02 07:40:36,6,2025-03-30 17:55:15,2,2024-09-14 17:35:27,2023-01-27 12:00:00,False,False,False,Alternative
WE SAW THE SUN!,Lil Yachty,Lil Yachty,"Anthony Clemons, Jr., Jacob Portrait, Jeremiah Raisen, Justin Raisen, Miles Parks McCollum & Patrick Wimberly",Let’s Start Here.,Alternative,11.11,5:31,7,14,2023,2024-02-02 07:45:25,7,2025-07-09 12:48:08,1,2024-02-23 16:36:40,2023-01-27 12:00:00,False,False,False,Alternative
drive ME crazy!,Lil Yachty,Lil Yachty,"Benjamin Goldwasser, nami, Jeremiah Raisen, Macbriare Samuel Lanyon Demarco, Miles Parks McCollum, Patrick Wimberly, RUE & Teo Lucas Halm",Let’s Start Here.,Alternative,7.95,3:49,8,14,2023,2024-02-02 07:51:08,11,2025-06-20 14:48:16,1,2025-03-08 10:48:41,2023-01-27 12:00:00,True,True,False,Alternative
paint THE sky,Lil Yachty,Lil Yachty,"Daystar Shemuel Shua Peterson, Jeremiah Raisen, Justin Raisen, Miles Parks McCollum & Patrick Wimberly",Let’s Start Here.,Alternative,6.55,3:05,11,14,2023,2024-02-02 07:58:30,13,2025-04-30 03:59:12,3,2025-02-26 03:44:34,2023-01-27 12:00:00,False,True,False,Alternative
sHouLd i B?,Lil Yachty,Lil Yachty,"Jacob Portrait, Jeremiah Raisen, Justin Raisen, Miles Parks McCollum & Patrick Wimberly",Let’s Start Here.,Alternative,5.94,2:48,12,14,2023,2024-02-02 08:00:04,3,2025-03-04 23:18:46,2,2025-03-05 12:59:35,2023-01-27 12:00:00,True,False,False,Alternative
Final Form,Lil Yachty,Lil Yachty,Miles Parks McCollum & Martin Rafeal Mc Curtis,Michigan Boy Boat,Hip-Hop/Rap,4.78,2:14,1,14,2021,2024-02-02 08:06:38,10,2025-05-03 23:11:47,3,2024-09-13 18:37:49,2021-04-23 12:00:00,True,False,False,Hip-Hop/Rap
Dynamic Duo,Lil Yachty & Tee Grizzley,Lil Yachty,"Dion Hayes, Martin Rafeal Mc Curtis, Miles Parks McCollum & Terry Sanchez Wallace",Michigan Boy Boat,Hip-Hop/Rap,7.76,3:47,2,14,2021,2024-02-02 08:09:21,19,2025-03-29 20:55:55,5,2024-10-13 15:49:23,2021-04-23 12:00:00,True,True,False,Hip-Hop/Rap
Concrete Goonies,Lil Yachty,Lil Yachty,"Miles Parks McCollum, Damario Horne McCullough, Piero Umiliani & Daniel Ray Robinson, Jr.",Michigan Boy Boat,Hip-Hop/Rap,4.59,2:07,3,14,2021,2024-02-02 08:12:55,19,2025-02-25 18:44:25,0,,2021-04-23 12:00:00,True,False,False,Hip-Hop/Rap
Stunt Double (feat. Rio Da Yung Og),Lil Yachty,Lil Yachty,"Miles Parks McCollum, Damario Horne McCullough, Daniel Ray Robinson, Jr. & Tony Green",Michigan Boy Boat,Hip-Hop/Rap,4.46,2:02,11,14,2021,2024-02-02 08:25:51,11,2024-12-11 03:09:01,2,2024-05-04 22:07:41,2021-04-23 12:00:00,True,False,False,Hip-Hop/Rap
Been a Minute,Bakar,Bakar,Bakar & Zach Nahome,Will You Be My Yellow? - EP,Hip-Hop/Rap,5.62,2:41,5,6,2019,2024-02-02 08:37:02,24,2025-04-23 18:03:24,6,2024-12-06 16:29:54,2019-09-20 12:00:00,False,False,False,Hip-Hop/Rap
NW3,Bakar,Bakar,Bakar & Zach Nahome,Nobody's Home,Alternative,7.8,3:53,12,13,2022,2024-02-02 08:40:02,9,2025-07-06 20:47:40,4,2025-04-02 15:28:08,2022-01-28 08:00:00,True,False,False,Alternative
Ghosts,Bakar,Bakar,Bakar & Matthew Tavares,Will You Be My Yellow? - EP,Hip-Hop/Rap,5.62,2:41,3,6,2019,2024-02-02 17:32:57,7,2024-08-23 17:42:03,2,2024-09-06 13:30:48,2019-09-20 12:00:00,False,False,False,Hip-Hop/Rap
Come Outside (feat. YTB Fatt),Icewear Vezzo,Icewear Vezzo,"Chivez Smith, Nolan Griffis & Deshun Cavon Paige Sr.",Live From The 6,Hip-Hop/Rap,4.89,2:14,9,13,2023,2024-02-02 17:53:40,3,2025-04-26 22:40:22,2,2024-07-30 22:43:57,2023-09-22 12:00:00,True,False,False,Hip-Hop/Rap
Motion (feat. Babyface Ray) [Remix],Icewear Vezzo,Icewear Vezzo,"Chivez Smith, Marcellus Register, Shane Berry & Floyd Jerome Tolliver, Jr.",Live From The 6,Hip-Hop/Rap,4.77,2:12,7,13,2024,2024-02-02 18:01:47,9,2024-07-13 13:53:00,4,2025-05-16 14:10:33,2024-01-31 12:00:00,True,False,False,Hip-Hop/Rap
I Ain't Mad At Ya,Icewear Vezzo,Icewear Vezzo,"Chivez Smith, Brian J. Wolf & Henning Grüschow",Live From The 6,Hip-Hop/Rap,5.32,2:30,10,13,2023,2024-02-02 18:04:01,5,2025-05-04 21:16:05,0,,2023-10-31 07:00:00,True,False,False,Hip-Hop/Rap
NO SLEEP $$$  (feat. Young Jonn),Blaqbonez,Blaqbonez,Emeka Akumefule & John Uwana Udomboso,Emeka Must Shine,Hip-Hop/Rap,6.5,3:07,11,14,2023,2024-02-08 01:07:07,5,2024-12-27 13:47:09,3,2024-04-02 07:22:07,2023-10-27 12:00:00,False,False,False,Hip-Hop/Rap
Paper Planes,M.I.A.,M.I.A.,"Joe Strummer, Maya Arulpragasam, Mick Jones, Topper Headon, Paul Simonon & Thomas Wesley Pentz",Kala,Electronic,7.6,3:25,11,12,2007,2024-02-09 11:48:22,6,2025-04-26 15:18:07,2,2024-02-18 16:27:00,2007-08-08 07:00:00,False,False,False,EDM/Amapiano
B.E.D.,Jacquees,Jacquees,"Rodriquez Broadnax, Mbeng Denzel Ayuk-okata, Kelvin Raynard Brown Jr., Myron Avant & Steve Huff",4275 (Bonus Version),R&B/Soul,7.97,3:56,5,19,2016,2024-02-09 11:50:50,3,2025-03-28 20:23:59,1,2024-11-20 21:47:46,2016-07-08 12:00:00,True,False,False,R&B/Soul
Cry (shayo) [feat. Lojay],Majeeed,Majeeed,Ekeh Chiaka Joseph & Lekan Osifeso Junior,Cry (shayo) [feat. Lojay] - Single,African,5.83,2:48,1,1,2023,2024-02-15 04:34:28,6,2025-06-27 20:21:41,1,2024-04-02 07:25:38,2023-09-06 12:00:00,False,False,True,Afrobeats
BURN,"¥$, Kanye West & Ty Dolla $ign","¥$, Kanye West & Ty Dolla $ign","Christopher C. Dotson, Tyrone Griffin, Jr., Azul Wynter, Leon Thomas, Morten Ristorp, SAMUEL C. LINDLEY, Kanye West, Amir Stivie B, John Beck, Joseph Goddard, Tyshane Thompson, Valentina Pappalardo & Ye",VULTURES 1,Hip-Hop/Rap,4.1,1:51,9,15,2024,2024-02-16 16:15:55,16,2025-03-03 21:03:18,0,,2024-02-09 12:00:00,True,False,False,Hip-Hop/Rap
Spin,Kodak Black,Kodak Black,"Bill K. Kapri, DeWud Miyal Carr & Tye Gibson",Kutthroat Bill: Vol. 1,Hip-Hop/Rap,5.36,2:31,12,19,2019,2024-02-18 16:10:37,13,2025-04-11 20:14:53,0,,2019-10-25 12:00:00,True,False,False,Hip-Hop/Rap
HALLELUJAH (feat. Blaqbonez),CKay,CKay,"Kareem Olasunkanmi Temitayo, Chukwuka Ekweani & Emeka Akumefule",HALLELUJAH (feat. Blaqbonez) - Single,Afrobeats,4.95,2:17,1,1,2023,2024-02-18 21:25:14,5,2025-06-22 05:12:55,4,2024-12-27 02:52:08,2023-05-05 12:00:00,False,False,False,Afrobeats
